[
    {
        "id": "663856000",
        "daire": "1. Hukuk Dairesi",
        "esasNo": "2021/378",
        "kararNo": "2021/1418",
        "kararTarihi": "11.03.2021",
        "arananKelime": "hukuk dairesi",
        "index": 1,
        "siraNo": 1,
        "kararMetni": "1. Hukuk Dairesi         2021/378 E.  ,  2021/1418 K.\n\n\n\"İçtihat Metni\"\nMAHKEMESİ\t: ... BÖLGE ADLİYE MAHKEMESİ HUKUK DAİRELERİ  BAŞKANLAR KURULU\n \n... Bölge Adliye Mahkemesi Hukuk Daireleri Başkanlar Kurulu’nun 30.12.2020 tarih ve 2020/7-1 Karar (Uyuşmazlık) sayılı dosyası ve ekleri incelendi, gereği görüşülüp düşünüldü;\n-KARAR-\n           ... 7. Asliye Hukuk Mahkemesinin 14.11.2020 tarih ve 2020/1239 Muh. sayılı yazısı kapsamında; Mahkeme Hakimi ...’in ... Bölge Adliye Mahkemesi 3. Hukuk Dairesi,  ... Bölge Adliye Mahkemesi 1. Hukuk Dairesi,  ... Bölge Adliye Mahkemesi 2. Hukuk Dairesi,  ... Bölge Adliye Mahkemesi 8. Hukuk Dairesi,  ... Bölge Adliye Mahkemesi 15. Hukuk Dairesi,  ... Bölge Adliye Mahkemesi 1. Hukuk Dairesi,  ... Bölge Adliye Mahkemesi 4. Hukuk Dairesi,  ... Bölge Adliye Mahkemesi 17. Hukuk Dairesi ve ... Bölge Adliye Mahkemesi 1. Hukuk Dairesi arasında oluşan içtihat aykırılığının giderilmesi talepli dilekçesi ile 5235 sayılı Adli Yargı İlk Derece Mahkemeleri ile Bölge Adliye Mahkemelerinin Kuruluş, Görev ve Yetkileri Hakkındaki Kanun’un 35/3. maddesi uyarınca Yargıtay ilgili Hukuk Dairesine başvurulması istenilmiştir.\n     ... Bölge Adliye Mahkemesi Hukuk Daireleri Başkanlar Kurulunca ise; 30.12.2020 tarih ve 2020/7-1 Karar (Uyuşmazlık) sayılı kararı ile “ ... Bölge Adliye Mahkemesi 3. Hukuk Dairesi,  ... Bölge Adliye Mahkemesi 1. Hukuk Dairesi,  ... Bölge Adliye Mahkemesi 2. Hukuk Dairesi,  ... Bölge Adliye Mahkemesi 8. Hukuk Dairesi,  ... Bölge Adliye Mahkemesi 15. Hukuk Dairesi,  ... Bölge Adliye Mahkemesi 1. Hukuk Dairesi,  ... Bölge Adliye Mahkemesi 4. Hukuk Dairesi,  ... Bölge Adliye Mahkemesi 17. Hukuk Dairesi ve  ... Bölge Adliye Mahkemesi 1. Hukuk Dairesinin kesin kararları arasında uyuşmazlık bulunduğuna oy birliği ile ve söz konusu uyuşmazlığın  ... Bölge Adliye Mahkemesi 3. Hukuk Dairesi,  ... Bölge Adliye Mahkemesi 1. Hukuk Dairesi,  ... Bölge Adliye Mahkemesi 2. Hukuk Dairesi,  ... Bölge Adliye Mahkemesi 8. Hukuk Dairesi,  ... Bölge Adliye Mahkemesi 15. Hukuk Dairesi,  ... Bölge Adliye Mahkemesi 1. Hukuk Dairesi, ... Bölge Adliye Mahkemesi 4. Hukuk Dairesinin kararları doğrultusunda giderilmesine 4 oya karşı 12 oy çokluğu ile karar verilmiş, bilahare, karar ve ekleri   gereğinin takdir ve ifası için Dairemize gönderilmiştir.   \nBilindiği üzere; 5235 sayılı Adli Yargı İlk Derece Mahkemeleri ile Bölge Adliye Mahkemelerinin Kuruluş, Görev ve Yetkileri Hakkındaki Kanun’un “Başkanlar kurulu’nun görevleri” başlıklı  35. maddesinin 1. fıkrasının 3 numaralı bendinde “Re'sen veya bölge adliye mahkemesinin ilgili hukuk veya ceza dairesinin ya da Cumhuriyet başsavcısının, Hukuk Muhakemeleri Kanunu veya Ceza Muhakemesi Kanununa göre istinaf yoluna başvurma hakkı bulunanların, benzer olaylarda bölge adliye mahkemesi hukuk veya ceza dairelerince verilen kesin nitelikteki kararlar arasında ya da bu mahkeme ile başka bir bölge adliye mahkemesi hukuk veya ceza dairelerince verilen kesin nitelikteki kararlar arasında uyuşmazlık bulunması hâlinde bu uyuşmazlığın giderilmesini gerekçeli olarak istemeleri üzerine, kendi görüşlerini de ekleyerek Yargıtaydan bu konuda bir karar verilmesini istemek” hükmüne yer verilmiş, aynı fıkranın dördüncü bendinde ise; “ (3) numaralı bende göre yapılacak istemler, ceza davalarında ... Başsavcılığına, hukuk davalarında ise ilgili hukuk dairesine iletilir. ... Başsavcılığı uyuşmazlık bulunduğuna kanaat getirmesi durumunda ilgili ceza dairesinden bir karar verilmesini talep eder. Uyuşmazlığın giderilmesine ilişkin olarak dairece bu fıkra uyarınca verilen kararlar kesindir. ” düzenlemesi öngörülmüştür.\n        Hâl böyle  olunca, ilgili konu bütün hukuk dairelerini ilgilendirmekle 5235 sayılı Adli Yargı İlk Derece Mahkemeleri ile Bölge Adliye Mahkemelerinin Kuruluş, Görev ve Yetkileri Hakkındaki Kanun’un 35/1. fıkrasının 3. ve 4. bentleri gereğince dosyanın Yargıtay Birinci Başkanlık Kurulu’na GÖNDERİLMESİNE, 11/03/2021 tarihinde oybirliğiyle karar verildi."
    },
    {
        "id": "522357700",
        "daire": "23. Hukuk Dairesi",
        "esasNo": "2013/8149",
        "kararNo": "2013/7081",
        "kararTarihi": "13.11.2013",
        "arananKelime": "hukuk dairesi",
        "index": 2,
        "siraNo": 2,
        "kararMetni": "23. Hukuk Dairesi         2013/8149 E.  ,  2013/7081 K.\n\n\n\"İçtihat Metni\"\nMAHKEMESİ\t:Asliye Hukuk Mahkemesi\n-KARAR-\nDava dosyası ilk olarak 19. Hukuk Dairesi'ne gönderilmiş olup; dosya, 19. Hukuk Dairesi görevsizlik kararı ile 13. Hukuk Dairesi'ne, 13. Hukuk Dairesince 4. Hukuk Dairesine, 4. Hukuk Dairesince ise Dairemize yollanmıştır. \nDava dosyasının,  04.02.2010 tarih ve 3 sayılı kararı uyarınca, üçüncü Dairece ( Yüksek 4. Hukuk Dairesi) başka bir daireye gönderme kararı verilmeden dosyanın işbölümü uyuşmazlığının  çözümlenmesi için  doğrudan  Hukuk Daireleri Başkanlar  Kurulu'na gönderilmesi gerekmektedir.\nSONUÇ: Yukarıda açıklanan nedenlerle  dosyanın  Hukuk Daireleri Başkanlar  Kuruluna GÖNDERİLMESİNE,  13.11.2013 tarihinde oybirliğiyle karar verildi."
    },
    {
        "id": "291597300",
        "daire": "3. Hukuk Dairesi",
        "esasNo": "2014/6004",
        "kararNo": "2014/6999",
        "kararTarihi": "07.05.2014",
        "arananKelime": "hukuk dairesi",
        "index": 3,
        "siraNo": 3,
        "kararMetni": "3. Hukuk Dairesi         2014/6004 E.  ,  2014/6999 K.\n\n\n\"İçtihat Metni\"\nMAHKEMESİ\t: ASLİYE HUKUK MAHKEMESİ (KAPATILAN ... AHM)\nDosya daha önce 1.Hukuk Dairesinin görevsizlik kararı ile 23.Hukuk Dairesine, 23.Hukuk Dairesinden 7.Hukuk Dairesine, 7.Hukuk Dairesinden 16.Hukuk Dairesine son olarak da 16.Hukuk Dairesinden Dairemize gönderilmiş olduğundan; dosyanın Hukuk Daireleri Başkanlar Kurulunca temyiz incelemesini yapacak daire belirtilmek üzere dosyanın Hukuk Daireleri Başkanlar Kuruluna gönderilmesine, 08.05.2014 gününde  oybirliğiyle karar verildi."
    },
    {
        "id": "967439500",
        "daire": "3. Hukuk Dairesi",
        "esasNo": "2010/18577",
        "kararNo": "2010/18632",
        "kararTarihi": "11.11.2010",
        "arananKelime": "hukuk dairesi",
        "index": 4,
        "siraNo": 4,
        "kararMetni": "3. Hukuk Dairesi         2010/18577 E.  ,  2010/18632 K.\n\n\n\"İçtihat Metni\"\nMAHKEMESİ\t:Sulh Hukuk Mahkemesi\n \nDosya daha önce 3.Hukuk Dairesinin görevsizlik kararı ile 18.Hukuk Dairesine, 18.Hukuk Dairesinden 12.Hukuk Dairesine, 2.Hukuk Dairesinden ise yine 3.Hukuk Dairesine gönderilmiş olup, buna göre inceleme görevi Hukuk Başkanlar Kurulunundur. Ancak, dosya dairemize 12.Hukuk Dairesinin görevsizlik kararı ile gelmiş olduğundan dosyanın temyiz incelemesini yapacak daireyi belirlemek üzere Hukuk Genel Kuruluna gönderilmesine,  11.11.2010 gününde oybirliğiyle karar verildi."
    },
    {
        "id": "267769800",
        "daire": "4. Hukuk Dairesi",
        "esasNo": "2013/13903",
        "kararNo": "2013/20238",
        "kararTarihi": "19.12.2013",
        "arananKelime": "hukuk dairesi",
        "index": 5,
        "siraNo": 5,
        "kararMetni": "4. Hukuk Dairesi         2013/13903 E.  ,  2013/20238 K.\n\n\n\"İçtihat Metni\"\nMAHKEMESİ\t:Asliye Hukuk Mahkemesi\nUyuşmazlık muris muvazaasına dayalı tazminat istemine ilişkindir. Aynı uyuşmazlıkla ilgili açılan tapu iptali ve tescil istemine ilişkin dava Yargıtay 1. Hukuk Dairesi tarafından incelenmiştir. Yargıtay Kanunun değişik 14. maddesine göre davaya bakma görevi Yargıtay 1. Hukuk Dairesine aittir. Ne var ki dosya önce 7. Hukuk Dairesine gelmiş bu daire tarafından 4. Hukuk Dairesine gönderilmiş, Dairemizce de 17. Hukuk Dairesine gönderilmiş ancak 17. Hukuk Dairesi tarafından dosyanın Hukuk Daireleri Başkanlar Kuruluna gönderilmesine karar verilmesine rağmen sehven dairemize gönderildiği anlaşılmakla dosyanın Yargıtay Hukuk Daireleri Başkanlar Kuruluna gönderilmesi gerekmektedir. \nSONUÇ: Açıklanan nedenlerle, dosyanın Yargıtay Hukuk Daireleri Başkanlar Kurulu'na gönderilmesine 19/12/2013 gününde oybirliğiyle karar verildi."
    },
    {
        "id": "1092695700",
        "daire": "3. Hukuk Dairesi",
        "esasNo": "2024/1319",
        "kararNo": "2024/2019",
        "kararTarihi": "24.06.2024",
        "arananKelime": "hukuk dairesi",
        "index": 6,
        "siraNo": 6,
        "kararMetni": "3. Hukuk Dairesi         2024/1319 E.  ,  2024/2019 K.\n\n\n\"İçtihat Metni\"\nMAHKEMESİ\t: Sakarya Bölge Adliye Mahkemesi 4. Hukuk Dairesi\nYargıtay 7. Hukuk Dairesi tarafından temyiz inceleme görevinin Dairemize ait olduğu gerekçesiyle gönderilen dava dosyası üzerinde, 2797 sayılı Yargıtay Kanunu'nun (2797 sayılı Kanun) 40 ıncı ve Yargıtay İç Yönetmeliği'nin 18 inci maddeleri uyarınca yapılan ön inceleme sonucunda; Yargıtay 7. Hukuk Dairesi ile Dairemiz arasında çıkan görev uyuşmazlığı üzerine Hukuk İşbölümü İnceleme Kurulunun 29.06.2022 tarihli kararıyla görevli dairenin Yargıtay 7. Hukuk Dairesi olarak belirlendiği, ancak geri çevirme kararından sonra Yargıtay 7. Hukuk Dairesince dosyanın yine görevsizlik gerekçesiyle bu sefer Yargıtay 4. Hukuk Dairesine gönderildiği, Yargıtay 4. Hukuk Dairesince dosyanın Hukuk İşbölümü İnceleme Kuruluna gönderilmesi üzerine Kurulun 20.02.2024 tarihli kararıyla, görevli dairenin belirlenmesine ilişkin kesin nitelikteki önceki kurul kararına karşın görevsizlik gerekçesiyle dosyanın tekrar başka daireye gönderilmesinin mümkün bulunmadığı belirtilerek dosyanın Yargıtay 7. Hukuk Dairesine gönderilmesine karar verildiği, buna rağmen Yargıtay 7. Hukuk Dairesince yine dosyanın Dairemize gönderildiği anlaşılmıştır.\n20.02.2024 tarihli Hukuk İşbölümü İnceleme Kurulu kararıyla görevli daire olarak belirlenen Yargıtay 7. Hukuk Dairesince temyiz incelemesi yapılması gerektiği ve başka daireye gönderme kararı verilemeyeceği açıkça belirtilmiş olduğundan görevli Yargıtay 7. Hukuk Dairesine gönderilmesine karar verilmiştir.\nKARAR\nAçıklanan sebeple;\nDosyanın YARGITAY 7. HUKUK DAİRESİNE GÖNDERİLMESİNE,\n24.06.2024 tarihinde oy birliğiyle karar verildi."
    },
    {
        "id": "448955100",
        "daire": "9. Hukuk Dairesi",
        "esasNo": "2013/6716",
        "kararNo": "2013/21789",
        "kararTarihi": "10.09.2013",
        "arananKelime": "hukuk dairesi",
        "index": 7,
        "siraNo": 7,
        "kararMetni": "9. Hukuk Dairesi         2013/6716 E.  ,  2013/21789 K.\n\n\n\"İçtihat Metni\"\nMAHKEMESİ\t:ASLİYE HUKUK (İŞ) MAHKEMESİ\n \n\tYargıtay Başkanlar Kurulu'nun 21.01.2013 günlü kararı ile; \n\t9ncu Hukuk Dairesi arşivinde bulunan dosyaların süratle eritilmesi amacıyla; \n\ta) Bu işbölümünün yürürlüğe girdiği tarihten itibaren 7nci, 9uncu ve 22inci Hukuk Dairelerine gönderilen ve ortak görevli bulundukları dosyaların tamamı, 12.000 sayısına ulaşana kadar 7nci Hukuk Dairesi esasına kaydedilir ve temyiz incelemesi bu daire tarafından yapılır. \n\tb) 12.000 dosya tamamlandıktan sonra, takip eden ve 7nci Hukuk Dairesinin görevli olduğu grup dışındaki mahkemelerden gelecek 24.000 dosya 22nci Hukuk Dairesi esasına kaydedilir ve temyiz incelemesi bu daire tarafından yapılır. \n\tKuralı gereğince Yargıtay 13. Hukuk Dairesi'nin gönderme kararı tarihi itibariyle İş Hukukundan kaynaklanan alacak taleplerinin temyiz incelemesi Yargıtay 22. Hukuk Dairesi'ne verilmiştir.\n\tSONUÇ: Taraflar arasındaki uyuşmazlığın İş Hukukundan kaynaklanması ve Yargıtay Başkanlar Kurulu'nun anılan kararına göre dosyanın Yargıtay 22. Hukuk Dairesi'ne GÖNDERİLMESİNE, 10.09.2013 tarihinde oybirliğiyle karar verildi."
    },
    {
        "id": "448899200",
        "daire": "9. Hukuk Dairesi",
        "esasNo": "2013/6550",
        "kararNo": "2013/21772",
        "kararTarihi": "10.09.2013",
        "arananKelime": "hukuk dairesi",
        "index": 8,
        "siraNo": 8,
        "kararMetni": "9. Hukuk Dairesi         2013/6550 E.  ,  2013/21772 K.\n\n\n\"İçtihat Metni\"\nMAHKEMESİ\t:ASLİYE HUKUK MAHKEMESİ\n\tYargıtay Başkanlar Kurulu'nun 21.01.2013 günlü kararı ile; \n\t9ncu Hukuk Dairesi arşivinde bulunan dosyaların süratle eritilmesi amacıyla; \n\ta) Bu işbölümünün yürürlüğe girdiği tarihten itibaren 7nci, 9uncu ve 22inci Hukuk Dairelerine gönderilen ve ortak görevli bulundukları dosyaların tamamı, 12.000 sayısına ulaşana kadar 7nci Hukuk Dairesi esasına kaydedilir ve temyiz incelemesi bu daire tarafından yapılır. \n\tb) 12.000 dosya tamamlandıktan sonra, takip eden ve 7nci Hukuk Dairesinin görevli olduğu grup dışındaki mahkemelerden gelecek 24.000 dosya 22nci Hukuk Dairesi esasına kaydedilir ve temyiz incelemesi bu daire tarafından yapılır. \n\tKuralı gereğince Yargıtay 3. Hukuk Dairesi'nin gönderme kararı tarihi itibariyle İş Hukukundan kaynaklanan işçilik alacakları taleplerinin temyiz incelemesi Yargıtay 22. Hukuk Dairesi'ne verilmiştir.\n\tSONUÇ: Taraflar arasındaki uyuşmazlığın İş Hukukundan kaynaklanması ve Yargıtay Başkanlar Kurulu'nun anılan kararına göre dosyanın Yargıtay 22. Hukuk Dairesi'ne GÖNDERİLMESİNE, 10.09.2013 tarihinde oybirliğiyle karar verildi."
    },
    {
        "id": "448929300",
        "daire": "9. Hukuk Dairesi",
        "esasNo": "2013/6618",
        "kararNo": "2013/21780",
        "kararTarihi": "10.09.2013",
        "arananKelime": "hukuk dairesi",
        "index": 9,
        "siraNo": 9,
        "kararMetni": "9. Hukuk Dairesi         2013/6618 E.  ,  2013/21780 K.\n\n\n\"İçtihat Metni\"\nMAHKEMESİ\t:ASLİYE HUKUK (İŞ) MAHKEMESİ\n \n\tYargıtay Başkanlar Kurulu'nun 21.01.2013 günlü kararı ile; \n\t9ncu Hukuk Dairesi arşivinde bulunan dosyaların süratle eritilmesi amacıyla; \n\ta) Bu işbölümünün yürürlüğe girdiği tarihten itibaren 7nci, 9uncu ve 22inci Hukuk Dairelerine gönderilen ve ortak görevli bulundukları dosyaların tamamı, 12.000 sayısına ulaşana kadar 7nci Hukuk Dairesi esasına kaydedilir ve temyiz incelemesi bu daire tarafından yapılır. \n\tb) 12.000 dosya tamamlandıktan sonra, takip eden ve 7nci Hukuk Dairesinin görevli olduğu grup dışındaki mahkemelerden gelecek 24.000 dosya 22nci Hukuk Dairesi esasına kaydedilir ve temyiz incelemesi bu daire tarafından yapılır. \n\tKuralı gereğince Yargıtay 19. Hukuk Dairesi'nin gönderme kararı tarihi itibariyle İş Hukukundan kaynaklanan alacak taleplerinin temyiz incelemesi Yargıtay 22. Hukuk Dairesi'ne verilmiştir.\n\tSONUÇ: Taraflar arasındaki uyuşmazlığın İş Hukukundan kaynaklanması ve Yargıtay Başkanlar Kurulu'nun anılan kararına göre dosyanın Yargıtay 22. Hukuk Dairesi'ne GÖNDERİLMESİNE, 10.09.2013 tarihinde oybirliğiyle karar verildi."
    },
    {
        "id": "448926700",
        "daire": "9. Hukuk Dairesi",
        "esasNo": "2013/6609",
        "kararNo": "2013/21779",
        "kararTarihi": "10.09.2013",
        "arananKelime": "hukuk dairesi",
        "index": 10,
        "siraNo": 10,
        "kararMetni": "9. Hukuk Dairesi         2013/6609 E.  ,  2013/21779 K.\n\n\n\"İçtihat Metni\"\nMAHKEMESİ\t:ASLİYE HUKUK (İŞ) MAHKEMESİ\n\tYargıtay Başkanlar Kurulu'nun 21.01.2013 günlü kararı ile; \n\t9ncu Hukuk Dairesi arşivinde bulunan dosyaların süratle eritilmesi amacıyla; \n\ta) Bu işbölümünün yürürlüğe girdiği tarihten itibaren 7nci, 9uncu ve 22inci Hukuk Dairelerine gönderilen ve ortak görevli bulundukları dosyaların tamamı, 12.000 sayısına ulaşana kadar 7nci Hukuk Dairesi esasına kaydedilir ve temyiz incelemesi bu daire tarafından yapılır. \n\tb) 12.000 dosya tamamlandıktan sonra, takip eden ve 7nci Hukuk Dairesinin görevli olduğu grup dışındaki mahkemelerden gelecek 24.000 dosya 22nci Hukuk Dairesi esasına kaydedilir ve temyiz incelemesi bu daire tarafından yapılır. \n\tKuralı gereğince Yargıtay 1. Hukuk Dairesi'nin gönderme kararı tarihi itibariyle İş Hukukundan kaynaklanan işçilik alacakları taleplerinin temyiz incelemesi Yargıtay 22. Hukuk Dairesi'ne verilmiştir.\n\tSONUÇ: Taraflar arasındaki uyuşmazlığın İş Hukukundan kaynaklanması ve Yargıtay Başkanlar Kurulu'nun anılan kararına göre dosyanın Yargıtay 22. Hukuk Dairesi'ne GÖNDERİLMESİNE, 10.09.2013 tarihinde oybirliğiyle karar verildi."
    },
    {
        "id": "489256500",
        "daire": "23. Hukuk Dairesi",
        "esasNo": "2013/2105",
        "kararNo": "2013/3606",
        "kararTarihi": "29.05.2013",
        "arananKelime": "hukuk dairesi",
        "index": 11,
        "siraNo": 11,
        "kararMetni": "23. Hukuk Dairesi         2013/2105 E.  ,  2013/3606 K.\n\n\n\"İçtihat Metni\"\nMAHKEMESİ\t:Asliye Hukuk Mahkemesi\n-KARAR-\n\tTemyize konu ... bu dava dosyası, ........2012 tarihinde ... .... Hukuk Dairesi'nce aidiyet kararıyla ... .... Hukuk Dairesi'ne gönderildiği, ... .... Hukuk Dairesince de, 31.01.2013 tarihinde dosyanın temyiz incelemesinin .... Hukuk Dairesinin görevine girdiği gerekçesiyle bu daireye gönderildiği anlaşılmıştır.\n\t\t... .... Hukuk Dairesince, ... Hukuk Daireleri Başkanlar Kurulu'nun 04.02.2010 tarih ve ... sayılı kararı gereğince; dosyanın dördüncü bir daireye gönderilmeden ... bölümü uyuşmazlığının çözümü için doğrudan Hukuk Dairesi Başkanlar Kurulu'na gönderilmesi gerekirken, Dairemize gönderildiği anlaşıldığından dosyanın ... bölümü uyuşmazlığının  çözümlenmesi için  Hukuk Daireleri Başkanlar  Kuruluna gönderilmesi gerekmektedir.\nSONUÇ:Yukarıda açıklanan nedenlerle, dosyanın Hukuk Daireleri Başkanlar  Kuruluna GÖNDERİLMESİNE, ....05.2013 tarihinde oybirliğiyle karar verildi."
    },
    {
        "id": "445683400",
        "daire": "2. Hukuk Dairesi",
        "esasNo": "2018/1729",
        "kararNo": "2018/10199",
        "kararTarihi": "27.09.2018",
        "arananKelime": "hukuk dairesi",
        "index": 12,
        "siraNo": 12,
        "kararMetni": "2. Hukuk Dairesi         2018/1729 E.  ,  2018/10199 K.\n\n\n\"İçtihat Metni\"\nMAHKEMESİ\t      :Asliye Hukuk   Mahkemesi\nDAVA TÜRÜ\t      : Tapu İptali ve Tescil\nTaraflar arasındaki davanın yapılan muhakemesi sonunda mahalli mahkemece verilen, yukarıda tarihi ve numarası gösterilen hüküm temyiz edilmekle, evrak okunup gereği görüşülüp düşünüldü:\nTaraflar arasında görülmekte olan kadastro öncesi miras sözleşmesine dayalı tapu iptal ve tescil davası nedeniyle verilen karar davacı tarafından temyiz edilmekle, Yargıtay 1. Hukuk Dairesi dosyayı Yargıtay 8. Hukuk Dairesine göndermiş, Yargıtaş 8. Hukuk Dairesi de 11.05.2015 tarihinde dosyayı inceleme görevinin Yargıtay 16. Hukuk Dairesine ait olduğunu belirterek, görevli Daire'yi belirlemek üzere dosyası Yargıtay Hukuk İşbölümü İnceleme Kuruluna göndermiştir. Yargıtay Hukuk İşbölümü İnceleme Kurulu 09.07.2015 tarihli ilamıyla dosyayı inceleme görevinin Yargıtay 16. Hukuk Dairesi'ne ait olduğuna karar vermiştir. 2797 sayılı Yargıtay Kanununun 60. maddesi uyarınca Yargıtay Hukuk İşbölümü İnceleme Kurulu tarafından verilen iş bölümüne ilişkin karar kesindir. Bu husus gözetilmeden Yargıtay 16. Hukuk Dairesi tarafından 20.02.2018 tarihli karar ile dosyayı inceleme görevinin Yargıtay 2. Hukuk Dairesine ait olduğu bildirilerek Dairemize gönderildiğinden dosyanın Yargıtay 16. Hukuk Dairesine geri gönderilmesi gerekmiştir.\n     SONUÇ:Yargıtay Hukuk İşbölümü İnceleme Kurulunun 09.07.2015 tarihli kararının kesin olduğu gözetilerek dosyanın Yargıtay 16. Hukuk Dairesine  gönderilmesine oybirliğiyle karar verildi.  27.09.2018 (Per.)"
    },
    {
        "id": "174748900",
        "daire": "13. Hukuk Dairesi",
        "esasNo": "2015/8046",
        "kararNo": "2015/6455",
        "kararTarihi": "03.03.2015",
        "arananKelime": "hukuk dairesi",
        "index": 13,
        "siraNo": 13,
        "kararMetni": "13. Hukuk Dairesi         2015/8046 E.  ,  2015/6455 K.\n\n\n\"İçtihat Metni\"\nMAHKEMESİ\t:Sulh Hukuk Mahkemesi\nKARAR\nDava, Asliye Hukuk Makemesine açılmış, taraflar arasındaki ilişkinin kira ilişkisinden kaynaklandığı Asliye Hukuk Mahkemesince kabul edilerek Sulh Hukuk Mahkemesine görevsizlik kararı verilmiş olup bu karar 6. Hukuk Dairesi tarafından onanmak suretiyle kira ilişkisinin benimsendiği anlaşıldığından kararın temyizen incelenmesi görevi Yargıtay 6. Hukuk Dairesine aittir.\nSONUÇ:Dosyanın görevli Yargıtay Yüksek 6.Hukuk Dairesi Başkanlığına GÖNDERİLMESİNE, 03.03.2015 gününde oybirliğiyle karar verildi."
    },
    {
        "id": "326396500",
        "daire": "2. Hukuk Dairesi",
        "esasNo": "2017/2062",
        "kararNo": "2017/4053",
        "kararTarihi": "10.04.2017",
        "arananKelime": "hukuk dairesi",
        "index": 14,
        "siraNo": 14,
        "kararMetni": "2. Hukuk Dairesi         2017/2062 E.  ,  2017/4053 K.\n\n\n\"İçtihat Metni\"\nMAHKEMESİ\t      :Sulh Hukuk Mahkemesi\nTaraflar arasındaki davanın yapılan muhakemesi sonunda mahalli mahkemece verilen, yukarıda tarihi ve numarası gösterilen hüküm temyiz edilmekle, evrak okunup gereği görüşülüp düşünüldü:\nDosya 14/11/2016 tarihinde Yargıtay 1. Hukuk Dairesine gönderilmiş, Yargıtay 1. Hukuk Dairesi dosyayı 05/12/2016 tarihinde Yargıtay 8. Hukuk Dairesine, Yargıtay 8. Hukuk Dairesi ise görevli Daireyi belirlemek üzere 16/12/2016 tarihinde Yargıtay Hukuk İşbölümü İnceleme Kurulu'na göndermiş, Hukuk İşbölümü İnceleme Kurulu 28/02/2017 tarihinde temyiz itirazlarını inceleme görevinin Yargıtay 8. Hukuk Dairesine ait olduğuna karar vermiştir. Yargıtay 8. Hukuk Dairesi 23/03/2017 tarihinde Yargıtay 2. Hukuk Dairesinin görevli olduğunu belirterek dosyayı bu kez Dairemiz'e göndermiş ise de, 2797 sayılı Kanununun 01/07/2016 tarih 6723 sayılı Kanunla değişik 60. maddesinin 3. fıkrası uyarınca Hukuk İşbölümü İnceleme Kurulu tarafından yapılan öninceleme sonunda verilen işbölüme ilişkin kararlar kesin olduğundan dosyanın temyiz incelemesi için Yargıtay 8. Hukuk Dairesine geri gönderilmesine karar vermek gerekmiştir. \nSONUÇ : Yukarıda belirtilen sebeple dosyanın görevli Yargıtay 8. Hukuk Dairesi Başkanlığına gönderilmesine  oybirliğiyle karar verildi. 10.04.2017(Pzt.)"
    },
    {
        "id": "448900600",
        "daire": "9. Hukuk Dairesi",
        "esasNo": "2013/6551",
        "kararNo": "2013/21773",
        "kararTarihi": "10.09.2013",
        "arananKelime": "hukuk dairesi",
        "index": 15,
        "siraNo": 15,
        "kararMetni": "9. Hukuk Dairesi         2013/6551 E.  ,  2013/21773 K.\n\n\n\"İçtihat Metni\"\nMAHKEMESİ\t:ASLİYE HUKUK (İŞ) MAHKEMESİ\nYargıtay Başkanlar Kurulu'nun 21.01.2013 günlü kararı ile; \n9 ncu Hukuk Dairesi arşivinde bulunan dosyaların süratle eritilmesi amacıyla; \na) Bu işbölümünün yürürlüğe girdiği tarihten itibaren 7 nci, 9 uncu ve 22 inci Hukuk Dairelerine gönderilen ve ortak görevli bulundukları dosyaların tamamı, 12.000 sayısına ulaşana kadar 7 nci Hukuk Dairesi esasına kaydedilir ve temyiz incelemesi bu daire tarafından yapılır. \nb) 12.000 dosya tamamlandıktan sonra, takip eden ve 7 nci Hukuk Dairesinin görevli olduğu grup dışındaki mahkemelerden gelecek 24.000 dosya 22 nci Hukuk Dairesi esasına kaydedilir ve temyiz incelemesi bu daire tarafından yapılır. \nKuralı gereğince Yargıtay 3. Hukuk Dairesi'nin gönderme kararı tarihi itibariyle İş Hukukundan kaynaklanan işçilik alacakları taleplerinin temyiz incelemesi Yargıtay 22. Hukuk Dairesi'ne verilmiştir.\nSONUÇ: Taraflar arasındaki uyuşmazlığın İş Hukukundan kaynaklanması ve Yargıtay Başkanlar Kurulu'nun anılan kararına göre dosyanın Yargıtay 22. Hukuk Dairesi'ne GÖNDERİLMESİNE, 10.09.2013 tarihinde oybirliğiyle karar verildi."
    },
    {
        "id": "267874400",
        "daire": "2. Hukuk Dairesi",
        "esasNo": "2013/12153",
        "kararNo": "2013/17572",
        "kararTarihi": "24.06.2013",
        "arananKelime": "hukuk dairesi",
        "index": 16,
        "siraNo": 16,
        "kararMetni": "2. Hukuk Dairesi         2013/12153 E.  ,  2013/17572 K.\n\n\n\"İçtihat Metni\"\nMAHKEMESİ\t:Asliye Hukuk Mahkemesi\nDAVA TÜRÜ \t:Tapu İptal ve Tescil\n \nTaraflar arasındaki davanın yapılan muhakemesi sonunda mahalli mahkemece verilen,  yukarıda tarihi ve numarası gösterilen hüküm temyiz edilmekle, evrak okunup gereği görüşülüp düşünüldü:\nDairemizin 4.6.2012 tarihli ilamı ile mahkemece uyuşmazlığın Türk Borçlar Kanununun 18. maddesinde yer alan muvazaaya dayalı tasarrufun iptali ve tescil istemi olarak vasıflandırıldığı gerekçesiyle, dosyayı inceleme görevinin Yargıtay 4. Hukuk Dairesine ait olduğuna karar verilmiş, Yargıtay 4. Hukuk Dairesi 4.7.2012 tarihinde dosyayı görevsizlikle Yargıtay 8. Hukuk dairesine göndermiş, Yargıtay 8. Hukuk Dairesi Daireler arasındaki görev uyuşmazlığı giderilmek üzere  dosyayı Yargıtay Hukuk Daireleri Başkanlar Kuruluna göndereceği yerde yine görevsizlikle 7.3.2013 tarihinde Yargıtay l. Hukuk Dairesine, Yargıtay l. Hukuk Dairesi 22.4.2013 tarihinde Yargıtay 14. Hukuk Dairesine Yargıtay 14. Hukuk Dairesi ise 21.05.2013 tarihinde  tekrar Dairemize geri göndermiştir.    \n SONUÇ : Yukarıda belirtilen sebeple dosyanın görevli Yargıtay Hukuk Daireleri Başkanlar Kurulu  Yüksek Başkanlığına gönderilmesine oybirliğiyle karar verildi. 24.06.2013 (Pzt.)"
    },
    {
        "id": "667378400",
        "daire": "11. Hukuk Dairesi",
        "esasNo": "2011/15242",
        "kararNo": "2011/17044",
        "kararTarihi": "14.12.2011",
        "arananKelime": "hukuk dairesi",
        "index": 17,
        "siraNo": 17,
        "kararMetni": "11. Hukuk Dairesi         2011/15242 E.  ,  2011/17044 K.\n\n\n\"İçtihat Metni\"\nMAHKEMESİ\t:Asliye Hukuk Mahkemesi\n            Dava, kira sözleşmesine dayalı el atmanın önlenmesi ve tahliye istemine ilişkindir.\nYargıtay Büyük Genel Kurulu'nun 12.05.2011 gün ve 1 sayılı kararı uyarınca temyiz incelemesinin 13. Hukuk Dairesi'ce yapılmasına karar verildiğinden dosyanın Yargıtay Yüksek 13. Hukuk Dairesi Başkanlığı'na gönderilmesi gerekmiştir.\nAncak dosyanın Yargıtay 13. Hukuk Dairesi tarafından 4. Hukuk Dairesi'ne, 4. Hukuk Dairesi tarafından Dairemize gönderilmiş olup, görev uyuşmazlığının çözümü için dosyanın Yüksek Yargıtat Hukuk Başkanlar Kurulu'na gönderilmesi gerekmiştir.\nSONUÇ: Yukarıda açıklanan nedenlerle Dairemizin görevsizliğine, dosyanın Yüksek Yargıtay Hukuk Başkanlar Kurulu’na sunulmak üzere Yargıtay Birinci Başkanlığı’na GÖNDERİLMESİNE,  14.12.2011 tarihinde oybirliğiyle karar verildi."
    },
    {
        "id": "613478000",
        "daire": "11. Hukuk Dairesi",
        "esasNo": "2011/3944",
        "kararNo": "2012/6136",
        "kararTarihi": "16.04.2012",
        "arananKelime": "hukuk dairesi",
        "index": 18,
        "siraNo": 18,
        "kararMetni": "11. Hukuk Dairesi         2011/3944 E.  ,  2012/6136 K.\n\n\n\"İçtihat Metni\"\nMAHKEMESİ\t:Asliye Hukuk Mahkemesi\nDavalı kooperatifin, davacı kooperatifin çalışma alanına yaptığı müdahalenin men'i istemine ilişkindir.\nYargıtay Büyük Genel Kurulu'nun 12.05.2011 gün ve 1 sayılı kararı uyarınca temyiz incelemesinin 23. Hukuk Dairesi'nce yapılmasına karar verildiğinden dosyanın Yargıtay Yüksek 23. Hukuk Dairesi Başkanlığı'na gönderilmesi gerekmiştir.\nAncak, dosya Yargıtay 1. Hukuk Dairesi tarafından 14. Hukuk Dairesi'ne, 14. Hukuk Dairesi tarafından da Dairemize gönderildiğinden 3. defa verilen görevsizlik kararı nedeniyle, görev uyuşmazlığının çözümü için dosyanın Yüksek Yargıtay Hukuk Başkanlar Kurulu'na gönderilmesi gerekmiştir.\nSONUÇ : Yukarıdaki açıklanan nedenlerle, dosyanın görev uyuşmazlığının çözümü için Yüksek Yargıtay Hukuk Başkanlar Kurulu'na GÖNDERİLMESİNE, 16.04.2012 tarihinde oybirliğiyle karar verildi."
    },
    {
        "id": "151438200",
        "daire": "4. Hukuk Dairesi",
        "esasNo": "2015/4534",
        "kararNo": "2015/4241",
        "kararTarihi": "07.04.2015",
        "arananKelime": "hukuk dairesi",
        "index": 19,
        "siraNo": 19,
        "kararMetni": "4. Hukuk Dairesi         2015/4534 E.  ,  2015/4241 K.\n\n\n\"İçtihat Metni\"\nAsliye Hukuk Mahkemesi\nDosya içeriğine, temyizin kapsamına, uyuşmazlığın sosyal güvenlik hukukuna ilişkin bulunmasına göre, temyiz inceleme görevi Yargıtay Kanunu'nun 14. maddesi ve Başkanlar Kurulu kararı uyarınca Yargıtay  Hukuk Dairesine aittir. Ne var ki Yargıtay  Hukuk Dairesi ve Yargıtay Hukuk Dairesi tarafından da görevsizlik kararı verildiğinden dosyanın Yargıtay Hukuk Daireleri Başkanlar Kuruluna gönderilmesi gerekir. \nSONUÇ: Açıklanan nedenlerle dosyanın Yargıtay Hukuk Daireleri Başkanlar Kuruluna gönderilmesine  07/04/2015 gününde oybirliğiyle karar verildi."
    },
    {
        "id": "533240100",
        "daire": "3. Hukuk Dairesi",
        "esasNo": "2012/13783",
        "kararNo": "2012/18755",
        "kararTarihi": "13.09.2012",
        "arananKelime": "hukuk dairesi",
        "index": 20,
        "siraNo": 20,
        "kararMetni": "3. Hukuk Dairesi         2012/13783 E.  ,  2012/18755 K.\n\n\n\"İçtihat Metni\"\nMAHKEMESİ:ASLİYE HUKUK MAHKEMESİ\nUyuşmazlık, meni müdahale ve ecrimisil taleplerine ilişkindir. Dosyanın Yargıtay 1.Hukuk Dairesi tarafından dairemize gönderilmesi üzerine dosya 31.10.2011 tarihinde Hukuk Başkanlar Kurulu'na gönderilmiştir. Hukuk Başkanlar Kurulu'nun 22.03.2012 tarihli kararıyla 1.Hukuk Dairesinin görevsizlik kararı kaldırılmasına rağmen, dosya sehven 18.06.2012 tarihli kararla 1.Hukuk Dairesince Dairemize gönderilmiştir.Davanın bu niteliğine göre inceleme görevi Yargıtay  1. Hukuk Dairesinindir. Bu itibarla dosyanın gerekli inceleme yapılmak üzere Yüksek 1. Hukuk Dairesine gönderilmesine, 13.09.2012 gününde oybirliğiyle karar verildi."
    },
    {
        "id": "618578800",
        "daire": "11. Hukuk Dairesi",
        "esasNo": "2020/7204",
        "kararNo": "2020/4763",
        "kararTarihi": "05.11.2020",
        "arananKelime": "hukuk dairesi",
        "index": 21,
        "siraNo": 21,
        "kararMetni": "11. Hukuk Dairesi         2020/7204 E.  ,  2020/4763 K.\n\n\n\"İçtihat Metni\"\nMAHKEMESİ\t:  BÖLGE ADLİYE MAHKEMESİ \nAdana Bölge Adliye Mahkemesi 9. Hukuk Dairesi'nce verilen 2018/1703 Esas ve 2019/801 Karar  sayılı ve 17.07.2019 tarihli hükmün davalı ... vekili tarafından adli yardım talepli olarak temyiz edilmesi üzerine Yargıtay 19. Hukuk Dairesi'nin 2020/110 Esas ve 2020/204 Karar sayılı ve 03.02.2020 tarihli ilamı ile adli yardım talebinin reddine karar verilerek itiraz mercinin Yargıtay 20. Hukuk Dairesi olarak gösterildiği, Yargıtay 20. Hukuk Dairesi'nin kapanması nedeniyle ilk derece mahkemesince adli yardım talebinin reddine dair itiraz dilekçesinin Yargıtay 23. Hukuk Dairesine gönderildiği, Yargıtay 23. Hukuk Dairesi'nce uyuşmazlığın Bankacılık Hukukundan kaynaklı olması nedeniyle Dairemize gönderildiği, Yargıtay 19. Hukuk Dairesi ile Yargıtay 11. Hukuk Dairesi'nin birleşmesi dolayısıyla itiraz isteminin adli yardım talebinini reddine ilişkin olmasından dolayı itiraz mercinin Yargıtay 12. Hukuk Dairesi  olduğu nazara alınarak itiraz istemini değerlendirmek üzere dosyanın Yargıtay 12. Hukuk Dairesi'ne gönderilmesi gerekmiştir.\nSONUÇ: Yukarıda açıklanan nedenler dolayısıyla dosyanın görevli Yargıtay 12. Hukuk Dairesi'ne gönderilmesine, 05.11.2020 tarihinde oybirliğiyle karar verildi."
    },
    {
        "id": "607152000",
        "daire": "11. Hukuk Dairesi",
        "esasNo": "2012/7934",
        "kararNo": "2012/10360",
        "kararTarihi": "12.06.2012",
        "arananKelime": "hukuk dairesi",
        "index": 22,
        "siraNo": 22,
        "kararMetni": "11. Hukuk Dairesi         2012/7934 E.  ,  2012/10360 K.\n\n\n\"İçtihat Metni\"\nMAHKEMESİ\t:Asliye Hukuk Mahkemesi\nTaraflar arasındaki uyuşmazlık, tacirler arası haksız fiile dayalı tazminat istemine ilişkin olup, Yargıtay 7. Hukuk Dairesi görevlidir.\nAncak, 13. Hukuk Dairesince  4. Hukuk Dairesine, 4. Hukuk Dairesince 17. Hukuk Dairesine, 17. Hukuk Dairesince de Dairemize gönderilmiştir.\nSONUÇ: Yukarıda açıklanan nedenlerle Dairemizin görevsizliğine, dosyanın Başkanlar Kurulu’na sunulmak üzere Yargıtay Birinci Başkanlığı’na GÖNDERİLMESİNE,  12.06.2012 tarihinde oybirliğiyle karar verildi."
    },
    {
        "id": "472535200",
        "daire": "23. Hukuk Dairesi",
        "esasNo": "2012/6108",
        "kararNo": "2013/594",
        "kararTarihi": "06.02.2013",
        "arananKelime": "hukuk dairesi",
        "index": 23,
        "siraNo": 23,
        "kararMetni": "23. Hukuk Dairesi         2012/6108 E.  ,  2013/594 K.\n\n\n\"İçtihat Metni\"\nMAHKEMESİ\t:Asliye Hukuk Mahkemesi\n- K A R A R -\n \n \n\tTemyize konu ... bu dava dosyası, ....01.2012 tarihinde ... .... Hukuk Dairesi'nce aidiyet kararıyla ... .... Hukuk Dairesi'ne gönderilmiş, ... .... Hukuk Dairesince de  ....06.2012 tarihinde dosyanın temyiz incelemesinin ... .... Hukuk Dairesinin görevine girdiği gerekçesiyle bu daireye gönderildiği anlaşılmıştır.\n... .... Hukuk Dairesince, ... Hukuk Daireleri Başkanlar Kurulu'nun 04.02.2010 tarih ve ... sayılı kararı gereğince dosyanın dördüncü bir daireye gönderilmeden işbölümü uyuşmazlığın çözümü için doğrudan Hukuk Dairesi Başkanlar Kurulu'na gönderilmesi gerekirken ........2012 tarihinde sehven Dairemize gönderildiği anlaşıldığından dosyanın işbölümü uyuşmazlığının  çözümlenmesi için  doğrudan Hukuk Daireleri Başkanlar Kuruluna gönderilmesi gerekmektedir.\nSONUÇ:Yukarıda açıklanan nedenlerle, dosyanın Hukuk Daireleri Başkanlar  Kuruluna GÖNDERİLMESİNE,  06.02.2013 tarihinde oybirliğiyle karar verildi."
    },
    {
        "id": "811901800",
        "daire": "19. Hukuk Dairesi",
        "esasNo": "2011/2850",
        "kararNo": "2011/13014",
        "kararTarihi": "20.10.2011",
        "arananKelime": "hukuk dairesi",
        "index": 24,
        "siraNo": 24,
        "kararMetni": "(Kapatılan)19. Hukuk Dairesi         2011/2850 E.  ,  2011/13014 K.\n\n\n\"İçtihat Metni\"\nMahkemesi\t:Sulh Hukuk Mahkemesi \n \n- K A R A R -\nUyuşmazlığın  eser sözleşmesinden kaynaklanmasına ve kararın Sulh Hukuk Mahkemesince  verilmiş olmasına göre, temyiz incelemesi Yüksek 14. Hukuk Dairesinin görevi dahilindedir.\nAncak, dava dosyası Yüksek 17. Hukuk Dairesi, Yüksek 13. Hukuk Dairesi ve Yüksek 3. Hukuk Dairesi Başkanlıkları’nın görevsizlik  kararları üzerine Dairemize geldiğinden, görev uyuşmazlığının çözümlenmesi için dosyanın Hukuk Daireleri Başkanlar Kurulu’na gönderilmesi gerekmektedir. \nSONUÇ : Yukarıda açıklanan nedenlerle dosyanın Yüksek 1. Başkanlığa gönderilmesine, 20.10.2011 gününde oybirliğiyle karar verildi."
    },
    {
        "id": "888623400",
        "daire": "19. Hukuk Dairesi",
        "esasNo": "2007/7162",
        "kararNo": "2007/7568",
        "kararTarihi": "27.07.2007",
        "arananKelime": "hukuk dairesi",
        "index": 25,
        "siraNo": 25,
        "kararMetni": "(Kapatılan)19. Hukuk Dairesi         2007/7162 E.  ,  2007/7568 K.\n\n\n\"İçtihat Metni\"\nMahkemesi\t:Asliye Hukuk Mahkemesi \nYapılan inceleme sonucu  Yüksek 11.Hukuk Dairesi  tarafından  dosyanın ilgisi yönünden  Yüksek 15.Hukuk Dairesine  gönderildiği,  Yüksek 15.Hukuk Dairesince  eksikliğin  ikmali  için dosyanın  yerel mahkemeye geri çevrildiği  yerel mahkemece eksikliğin ikmali  ile dosyanın  sehven  Yüksek 11.Hukuk  Dairesine  gönderildiği anlaşılmakla,  ilgisi nedeniyle dosyanın  Yüksek 15.Hukuk  Dairesi Başkanlığına gönderilmesi gerekmiştir. \nSONUÇ : Yukarıda açıklanan nedenlerle dosyanın temyiz incelemesini yapmakla görevli Yüksek 15.Hukuk Dairesi Başkanlığına gönderilmesine, 27.7.2007 gününde oybirliğiyle karar verildi."
    },
    {
        "id": "118167100",
        "daire": "23. Hukuk Dairesi",
        "esasNo": "2014/5949",
        "kararNo": "2014/5001",
        "kararTarihi": "27.06.2014",
        "arananKelime": "hukuk dairesi",
        "index": 26,
        "siraNo": 26,
        "kararMetni": "23. Hukuk Dairesi         2014/5949 E.  ,  2014/5001 K.\n\n\n\"İçtihat Metni\"\nMAHKEMESİ\t: Trabzon 2. Sulh Hukuk Mahkemesi\nTARİHİ\t: 25/01/2012\nNUMARASI\t: 2009/663-2012/70\n-KARAR-\nYargıtay Büyük Genel Kurulu'nun 09.02.2012 tarih ve 2012/1 sayılı Kararı'nın dayanağı olan 2797 sayılı Yargıtay Yasası'nın 14. maddesini değiştiren 6110 sayılı Yasa'nın 8. maddesinde, daireler arası iş bölümünün belirlenmesinde mahkeme kararındaki nitelendirmenin esas alınacağı öngörülmüştür. \nMahkemenin nitelendirmesine göre, uyuşmazlık; izinsiz enerji hattı kullanımından doğan alacak istemine ilişkin olup, kararın temyiz incelemesi Yüksek 13. Hukuk Dairesi'nin görevine girmektedir. \nDosyanın incelenmesinden Yargıtay Yüksek 6. Hukuk Dairesi tarafından görevsizlik kararı verilerek Yargıtay Yüksek 3. Hukuk Dairesi'ne gönderildiği, Yargıtay Yüksek 3. Hukuk Dairesi tarafından görevsizlik kararı verilerek Yargıtay Yüksek 13. Hukuk Dairesi'ne gönderildiği, Yargıtay 13. Hukuk Dairesi tarafından görevsizlik kararı verilerek Yargıtay Yüksek  7. Hukuk  Dairesi'ne gönderildiği, Yargıtay Yüksek 7. Hukuk Dairesi tarafından görevsizlik kararı verilerek Yargıtay Yüksek 3. Hukuk Dairesi'ne gönderildiği, Yargıtay Yüksek 3. Hukuk Dairesi tarafından görevsizlik kararı verilerek Dairemize gönderildiği anlaşıldığından,\nYargıtay Başkanlar Kurulu'nun 04.02.2010 tarih ve 3 sayılı kararı uyarınca, üçüncü Dairece başka bir daireye gönderme kararı verilmeden dosyanın iş bölümü uyuşmazlığının çözümlenmesi için doğrudan Hukuk Daireleri Başkanlar Kurulu'na gönderilmesi gerekmektedir. \nSONUÇ: Yukarıda açıklanan nedenlerle dosyanın Hukuk Daireleri Başkanlar Kurulu'na GÖNDERİLMESİNE, 27.06.2014 tarihinde oybirliğiyle karar verildi."
    },
    {
        "id": "448894100",
        "daire": "9. Hukuk Dairesi",
        "esasNo": "2013/6507",
        "kararNo": "2013/21769",
        "kararTarihi": "10.09.2013",
        "arananKelime": "hukuk dairesi",
        "index": 27,
        "siraNo": 27,
        "kararMetni": "9. Hukuk Dairesi         2013/6507 E.  ,  2013/21769 K.\n\n\n\"İçtihat Metni\"\nMAHKEMESİ\t:İŞ MAHKEMESİ\n              Yargıtay Başkanlar Kurulu'nun 21.01.2013 günlü kararı ile; \n\t9ncu Hukuk Dairesi arşivinde bulunan dosyaların süratle eritilmesi amacıyla; \n\ta) Bu işbölümünün yürürlüğe girdiği tarihten itibaren 7nci, 9uncu ve 22inci Hukuk Dairelerine gönderilen ve ortak görevli bulundukları dosyaların tamamı, 12.000 sayısına ulaşana kadar 7nci Hukuk Dairesi esasına kaydedilir ve temyiz incelemesi bu daire tarafından yapılır. \n\tb) 12.000 dosya tamamlandıktan sonra, takip eden ve 7nci Hukuk Dairesinin görevli olduğu grup dışındaki mahkemelerden gelecek 24.000 dosya 22nci Hukuk Dairesi esasına kaydedilir ve temyiz incelemesi bu daire tarafından yapılır. \n\tKuralı gereğince Yargıtay 20. Hukuk Dairesi'nin gönderme kararı tarihi itibariyle İş Hukukundan kaynaklanan işçilik alacakları taleplerinin temyiz incelemesi Yargıtay 22. Hukuk Dairesi'ne verilmiştir.\n\tSONUÇ: Taraflar arasındaki uyuşmazlığın İş Hukukundan kaynaklanması ve Yargıtay Başkanlar Kurulu'nun anılan kararına göre dosyanın Yargıtay 22. Hukuk Dairesi'ne GÖNDERİLMESİNE, 10.09.2013 tarihinde oybirliğiyle karar verildi."
    },
    {
        "id": "616353800",
        "daire": "11. Hukuk Dairesi",
        "esasNo": "2011/2227",
        "kararNo": "2012/3766",
        "kararTarihi": "13.03.2012",
        "arananKelime": "hukuk dairesi",
        "index": 28,
        "siraNo": 28,
        "kararMetni": "11. Hukuk Dairesi         2011/2227 E.  ,  2012/3766 K.\n\n\n\"İçtihat Metni\"\nMAHKEMESİ\t:Asliye Hukuk Mahkemesi\nTaraflar arasındaki uyuşmazlık,  davalı kooperatife ait dairenin devredilmesinden kaynaklanmaktadır.\nUyuşmazlığın açıklanan bu niteliğine ve tarafların sıfatına kararın temyiz inceleme görevi Yüksek Yargıtay  23.  Hukuk Dairesi Başkanlığına aittir. Ancak dosyanın Yargıtay 1. Hukuk Dairesi Başkanlığı tarafından 7. Hukuk Dairesi Başkanlığı'na, 7. Hukuk Dairesi Başkanlığı tarafından 15. Hukuk Dairesi Başkanlığı'na 15. Hukuk Dairesi Başkanlığı tarafından görevsizlikle Dairemize gönderildiği anlaşılmıştır.Dördüncü defa verilen gönderme kararı nedeniyle oluşan aidiyet uyuşmazlığının giderilmesi için dosyanın Yüksek Başkanlar Kuruluna gönderilmesine karar vermek gerekmiştir.\nSONUÇ : Yukarıdaki açıklanan nedenlerle, dosyanın  Yargıtay  Başkanlar Kuruluna sunulmak üzere YargıtayYüksek 1. Başkanlığı'na GÖNDERİLMESİNE, 13.03.2012 tarihinde oybirliğiyle karar verildi."
    },
    {
        "id": "439516800",
        "daire": "9. Hukuk Dairesi",
        "esasNo": "2013/6439",
        "kararNo": "2013/20691",
        "kararTarihi": "08.07.2013",
        "arananKelime": "hukuk dairesi",
        "index": 29,
        "siraNo": 29,
        "kararMetni": "9. Hukuk Dairesi         2013/6439 E.  ,  2013/20691 K.\n\n\n\"İçtihat Metni\"\n \nMAHKEMESİ\t:ASLİYE HUKUK (İŞ) MAHKEMESİ\n                                                 Y A R G I T A Y     K A R A R I \nYargıtay Başkanlar Kurulu'nun 21.01.2013 günlü kararı ile; \n9ncu Hukuk Dairesi arşivinde bulunan dosyaların süratle eritilmesi amacıyla; \na) Bu işbölümünün yürürlüğe girdiği tarihten itibaren 7nci, 9uncu ve 22inci Hukuk Dairelerine gönderilen ve ortak görevli bulundukları dosyaların tamamı, 12.000 sayısına ulaşana kadar 7nci Hukuk Dairesi esasına kaydedilir ve temyiz incelemesi bu daire tarafından yapılır. \nb) 12.000 dosya tamamlandıktan sonra, takip eden ve 7nci Hukuk Dairesinin görevli olduğu grup dışındaki mahkemelerden gelecek 24.000 dosya 22nci Hukuk Dairesi esasına kaydedilir ve temyiz incelemesi bu daire tarafından yapılır. \nKuralı gereğince Yargıtay 3. Hukuk Dairesi'nin gönderme kararı tarihi itibariyle İş Hukukundan kaynaklanan işçilik alacakları taleplerinin temyiz incelemesi Yargıtay 22. Hukuk Dairesi'ne verilmiştir.\nSONUÇ: Taraflar arasındaki uyuşmazlığın İş Hukukundan kaynaklanması ve Yargıtay Başkanlar Kurulu'nun anılan kararına göre dosyanın Yargıtay 22. Hukuk Dairesi'ne GÖNDERİLMESİNE, 08.07.2013 tarihinde oybirliğiyle karar verildi."
    },
    {
        "id": "442619900",
        "daire": "9. Hukuk Dairesi",
        "esasNo": "2013/6381",
        "kararNo": "2013/20401",
        "kararTarihi": "04.07.2013",
        "arananKelime": "hukuk dairesi",
        "index": 30,
        "siraNo": 30,
        "kararMetni": "9. Hukuk Dairesi         2013/6381 E.  ,  2013/20401 K.\n\n\n\"İçtihat Metni\"\n \nMAHKEMESİ\t:ASLİYE HUKUK (İŞ) MAHKEMESİ\n                                                  Y A R G I T A Y     K A R A R I \nYargıtay Başkanlar Kurulu'nun 21.01.2013 günlü kararı ile; \n9ncu Hukuk Dairesi arşivinde bulunan dosyaların süratle eritilmesi amacıyla; \na) Bu işbölümünün yürürlüğe girdiği tarihten itibaren 7nci, 9uncu ve 22inci Hukuk Dairelerine gönderilen ve ortak görevli bulundukları dosyaların tamamı, 12.000 sayısına ulaşana kadar 7nci Hukuk Dairesi esasına kaydedilir ve temyiz incelemesi bu daire tarafından yapılır. \nb) 12.000 dosya tamamlandıktan sonra, takip eden ve 7nci Hukuk Dairesinin görevli olduğu grup dışındaki mahkemelerden gelecek 24.000 dosya 22nci Hukuk Dairesi esasına kaydedilir ve temyiz incelemesi bu daire tarafından yapılır. \nKuralı gereğince Yargıtay 3. Hukuk Dairesi'nin gönderme kararı tarihi itibariyle İş Hukukundan kaynaklanan alacak taleplerinin temyiz incelemesi Yargıtay 22. Hukuk Dairesi'ne verilmiştir.\nSONUÇ: Taraflar arasındaki uyuşmazlığın İş Hukukundan kaynaklanması ve Yargıtay Başkanlar Kurulu'nun anılan kararına göre dosyanın Yargıtay 22. Hukuk Dairesi'ne GÖNDERİLMESİNE, 04.07.2013 tarihinde oybirliğiyle karar verildi."
    },
    {
        "id": "300196200",
        "daire": "4. Hukuk Dairesi",
        "esasNo": "2013/14319",
        "kararNo": "2014/10116",
        "kararTarihi": "18.06.2014",
        "arananKelime": "hukuk dairesi",
        "index": 31,
        "siraNo": 31,
        "kararMetni": "4. Hukuk Dairesi         2013/14319 E.  ,  2014/10116 K.\n\n\n\"İçtihat Metni\"\nMAHKEMESİ\t:Asliye Hukuk Mahkemesi\n Uyuşmazlığın haksız eyleme ilişkin bulunmasına göre, temyiz inceleme görevinin Yargıtay Yasası’nın 14. maddesi ve Başkanlar Kurulu kararı uyarınca 4. Hukuk Dairesine   ait olduğu gerekçesiyle Yargıtay 1. Hukuk Dairesi tarafından dava dosyası Dairemize gönderilmiş, Dairemizce uyuşmazlığın sözleşme ilişkisinden kaynaklandığı bu nedenle temyiz inceleme görevinin 13. Hukuk Dairesi'ne ait olduğu gerekçesiyle görevsizlik kararı verilmiştir. Yargıtay 13. Hukuk Dairesi tarafından da uyuşmazlığın sözleşme ilişkisinden kaynaklanmadığı belirtilerek temyiz inceleme görevinin 3. Hukuk Dairesi'ne ait olduğu belirtilerek görevsizlik kararı verilmiş, Yargıtay 3. Hukuk Dairesi tarafından da temyiz inceleme görevinin 4. Hukuk Dairesi'ne ait olduğu gerekçesiyle görevsizlik kararı verilerek dosya Dairemize gönderilmiştir. Hal böyle olunca dosyanın Yargıtay Hukuk Daireleri Başkanlar Kurulu'na gönderilmesi gerekirken tekrar dairemize gönderildiği anlaşılmaktadır. Şu durumda olumsuz görev uyuşmazlığının çözümü için dosyanın Yargıtay Hukuk Daireleri Başkanlar Kurulu'na gönderilmesi gerekir.\nSONUÇ: Açıklanan nedenlerle, dosyanın Yargıtay Hukuk Daireleri Başkanlar Kurulu'na gönderilmesine 18/06/2014 gününde oybirliğiyle karar verildi."
    },
    {
        "id": "657840800",
        "daire": "11. Hukuk Dairesi",
        "esasNo": "2012/446",
        "kararNo": "2012/416",
        "kararTarihi": "19.01.2012",
        "arananKelime": "hukuk dairesi",
        "index": 32,
        "siraNo": 32,
        "kararMetni": "11. Hukuk Dairesi         2012/446 E.  ,  2012/416 K.\n\n\n\"İçtihat Metni\"\nMAHKEMESİ\t:Asliye Hukuk Mahkemesi (İcra Hukuk)\nYargıtay Büyük Genel Kurulunun 12.05.2011 tarih ve 1 sayılı kararı gereğince,   Kooperatifler Hukukundan doğan davaların temyiz inceleme görevi, Yargıtay 23.Hukuk Dairesi Başkanlığına verilmiş olmakla, işbu dosyanın, temyiz incelemesi yapılmak üzere Yargıtay  23.Hukuk Dairesi Başkanlığı'na gönderilmesi gerekmiştir.\n           SONUÇ: Yukarıda açıklanan nedenlerle, dosyanın Yargıtay 23. Hukuk Dairesi Başkanlığına  gönderilmesine, 19.01.2011 tarihinde oybirliğiyle karar verildi."
    },
    {
        "id": "1007001200",
        "daire": "4. Hukuk Dairesi",
        "esasNo": "2010/7715",
        "kararNo": "2010/8747",
        "kararTarihi": "15.07.2010",
        "arananKelime": "hukuk dairesi",
        "index": 33,
        "siraNo": 33,
        "kararMetni": "4. Hukuk Dairesi         2010/7715 E.  ,  2010/8747 K.\n\n\n\"İçtihat Metni\"\nMAHKEMESİ\t:Asliye Hukuk Mahkemesi\n              \t  Dosya içeriğine, temyizin kapsamına, uyuşmazlığın 11. Hukuk Dairesi, 10. Hukuk Dairesi ve 21. Hukuk Dairesi Başkanlıkları tarafından verilen görevsizlik kararına ilişkin bulunmasına göre, temyiz inceleme görevi Yargıtay Yasası’nın 14. maddesi ve Başkanlar Kurulu kararı uyarınca Yargıtay Hukuk Daireleri Başkanlar Kuruluna aittir.\n\t SONUÇ: Açıklanan nedenlerle, dosyanın Yargıtay Hukuk Daireleri Başkanlar Kuruluna gönderilmesine 15/7/2010 gününde oybirliğiyle karar verildi."
    },
    {
        "id": "805421300",
        "daire": "19. Hukuk Dairesi",
        "esasNo": "2012/8678",
        "kararNo": "2012/10532",
        "kararTarihi": "27.06.2012",
        "arananKelime": "hukuk dairesi",
        "index": 34,
        "siraNo": 34,
        "kararMetni": "(Kapatılan)19. Hukuk Dairesi         2012/8678 E.  ,  2012/10532 K.\n\n\n\"İçtihat Metni\"\nMAHKEMESİ\t:Sulh Hukuk Mahkemesi\n- K A R A R -\nMahkemece dosyanın gönderildiği Yargıtay 3.Hukuk Dairesince temyiz incelemesinin Yargıtay 13.Hukuk Dairesinin görevine girdiğine ilişkin görevsizlik kararının, Yargıtay 3 ve 13 Hukuk Daireleri arasında çıkan görev uyuşmazlığı üzerine, Yargıtay  Hukuk Daireleri Başkanlar Kurulu'nun 2012/1263 E. 2012/1161 sayılı kararıyla kaldırılmasından sonra Dosyasının Yargıtay 3.Hukuk Dairesi yerine sehven dairemize gönderildiği anlaşılmaktadır.\nSONUÇ : Yukarıda açıklanan nedenlerle Yargıtay Hukuk Daireleri Başkanlar Kurulu kararında belirtildiği üzere dosyanın temyiz incelemesini yapmakla görevli Yüksek 3.Hukuk Dairesi Başkanlığına gönderilmesine, 27.06.2012 gününde oybirliğiyle karar verildi."
    },
    {
        "id": "889731500",
        "daire": "19. Hukuk Dairesi",
        "esasNo": "2008/12803",
        "kararNo": "2008/12659",
        "kararTarihi": "31.12.2008",
        "arananKelime": "hukuk dairesi",
        "index": 35,
        "siraNo": 35,
        "kararMetni": "(Kapatılan)19. Hukuk Dairesi         2008/12803 E.  ,  2008/12659 K.\n\n\n\"İçtihat Metni\"\nMahkemesi\t:Ticaret Mahkemesi\n- K A R A R -\nYerel mahkemece dosya Dairemize gönderilmiş, Dairemiz 21.04.2008 tarihinde uyuşmazlığın ... sözleşmesinden kaynaklandığı gerekçesi ile dosyayı 15. Hukuk Dairesi Başkanlığına göndermiştir. Yargıtay Yüksek 15. Hukuk Dairesi, Yüksek 13. Hukuk Dairesine, Yüksek 13. Hukuk Dairesi ise Yüksek 11. Hukuk Dairesi Başkanlığına dosyayı göndermiş, Yüksek 11. Hukuk Dairesi  Başkanlığı 19.12.2008 tarihinde dosyayı tekrar Dairemize göndermiştir. Hal böyle olunca olumsuz görev uyuşmazlığının Hukuk Daireleri Başkanlar Kurulunca çözümlenmesi gerekir.  \n \nSONUÇ : Yukarıda açıklanan nedenlerle dosyanın Birinci Başkanlığa sunulmasına, 31.12.2008 gününde oybirliğiyle karar verildi."
    },
    {
        "id": "606867200",
        "daire": "11. Hukuk Dairesi",
        "esasNo": "2011/13639",
        "kararNo": "2012/9798",
        "kararTarihi": "06.06.2012",
        "arananKelime": "hukuk dairesi",
        "index": 36,
        "siraNo": 36,
        "kararMetni": "11. Hukuk Dairesi         2011/13639 E.  ,  2012/9798 K.\n\n\n\"İçtihat Metni\"\nMAHKEMESİ\t:Asliye Hukuk Mahkemesi\nTaraflar arasındaki uyuşmazlık, araç kiralama sözleşmesinden kaynaklanan alacak istemine ilişkin olup, uyuşmazlığın niteliğine göre dosyanın temyiz incelemesi Yargıtay 6. Hukuk Dairesi Başkanlığı'nın görevine girmektedir.\nAncak, dosya 4. Hukuk Dairesi Başkanlığı tarafından 13. Hukuk Daire'sine, 13. Hukuk Dairesi tarafından da Daire'mize gönderildiğinden görev uyuşmazlığının çözümü için dosyanın Yüksek Yargıtay Hukuk Başkanlar Kuruluna sunulmak üzere Yargıtay Birinci Başkanlığı'na gönderilmesi gerekmiştir.\nSONUÇ : Yukarıdaki açıklanan nedenlerle, dosyanın görevli  Yüksek Yargıtay  Hukuk Başkanlar Kurulu'na sunulmak üzere Yargıtay Birinci Başkanlığı'na GÖNDERİLMESİNE, 06.06.2012 tarihinde oybirliğiyle karar verildi."
    },
    {
        "id": "635439100",
        "daire": "11. Hukuk Dairesi",
        "esasNo": "2010/14446",
        "kararNo": "2012/5567",
        "kararTarihi": "06.04.2012",
        "arananKelime": "hukuk dairesi",
        "index": 37,
        "siraNo": 37,
        "kararMetni": "11. Hukuk Dairesi         2010/14446 E.  ,  2012/5567 K.\n\n\n\"İçtihat Metni\"\nMAHKEMESİ\t:Asliye Hukuk Mahkemesi\nTaraflar arasındaki uyuşmazlık, kira bedeline dayalı mükerrer ödeme nedeniyle istirdat istemine ilişkindir.\nTarafların sıfatına ve uyuşmazlığın niteliğine göre dosyanın temyiz incelemesi Yargıtay 6. Hukuk Dairesi Başkanlığı'nın görevine girmektedir.\nAncak, dosya 2. Hukuk Dairesi Başkanlığı tarafından 13. Hukuk  Dairesine, 13. Hukuk Dairesi tarafından da Dairemize gönderildiğinden görev uyuşmazlığın çözümü için dosyanın Yüksek Yargıtay Hukuk Başkanlar Kuruluna sunulmak üzere Yargıtay Birinci Başkanlığı'na gönderilmesi gerekmiştir.\nSONUÇ : Yukarıdaki açıklanan nedenlerle, dosyanın görevli  Yüksek Yargıtay Hukuk Başkanlar Kurulu'na sunulmak üzere Yargıtay Birinci Başkanlığı'na GÖNDERİLMESİNE, 06.04.2012 tarihinde oybirliğiyle karar verildi."
    },
    {
        "id": "613170200",
        "daire": "11. Hukuk Dairesi",
        "esasNo": "2011/150",
        "kararNo": "2012/6811",
        "kararTarihi": "25.04.2012",
        "arananKelime": "hukuk dairesi",
        "index": 38,
        "siraNo": 38,
        "kararMetni": "11. Hukuk Dairesi         2011/150 E.  ,  2012/6811 K.\n\n\n\"İçtihat Metni\"\nMAHKEMESİ\t:Asliye Hukuk Mahkemesi\nTaraflar arasındaki uyuşmazlık, kooperatif üyeliğinden kaynaklanan tapu iptali ve tescil istemine ilişkin olup, uyuşmazlığın niteliğine göre dosyanın temyiz incelemesi Yargıtay 23. Hukuk Dairesi Başkanlığı'nın görevine girmektedir.\nAncak, dosya 1. Hukuk Dairesi Başkanlığı tarafından 14. Hukuk Daire'sine, 14. Hukuk Dairesi tarafından Daire'mize gönderildiğinden görev uyuşmazlığının çözümü için dosyanın Yüksek Yargıtay Hukuk Başkanlar Kuruluna sunulmak üzere Yargıtay Birinci Başkanlığı'na gönderilmesi gerekmiştir. \nSONUÇ : Yukarıdaki açıklanan nedenlerle, dosyanın görevli  Yüksek Yargıtay Hukuk Başkanlar Kurulu'na sunulmak üzere Yargıtay Birinci Başkanlığı'na GÖNDERİLMESİNE, 25.04.2012 tarihinde oybirliğiyle karar verildi."
    },
    {
        "id": "613161600",
        "daire": "11. Hukuk Dairesi",
        "esasNo": "2010/15884",
        "kararNo": "2012/6813",
        "kararTarihi": "25.04.2012",
        "arananKelime": "hukuk dairesi",
        "index": 39,
        "siraNo": 39,
        "kararMetni": "11. Hukuk Dairesi         2010/15884 E.  ,  2012/6813 K.\n\n\n\"İçtihat Metni\"\nMAHKEMESİ\t:Asliye Hukuk Mahkemesi\nTaraflar arasındaki uyuşmazlık, kooperatif üyeliğinin haksız olarak sona erdirilmesi nedeniyle tazminat istemine ilişkin olup, uyuşmazlığın niteliğine göre dosyanın temyiz incelemesi Yargıtay 23.  Hukuk Dairesi Başkanlığı'nın görevine girmektedir.\nAncak dosya 3. Hukuk Dairesi Başkanlığı tarafından 13. Hukuk Daire'sine, 13. Hukuk Dairesi tarafından da Daire'mize gönderildiğinden görev uyuşmazlığın çözümü için dosyanın Yüksek Yargıtay Hukuk Başkanlar Kuruluna sunulmak üzere Yargıtay Birinci Başkanlığı'na gönderilmesi gerekmiştir.\nSONUÇ : Yukarıdaki açıklanan nedenlerle, dosyanın görevli  Yüksek Yargıtay  Hukuk Başkanlar Kurulu'na sunulmak üzere Yargıtay Birinci Başkanlığı'na GÖNDERİLMESİNE,25.04.2012  tarihinde oybirliğiyle karar verildi."
    },
    {
        "id": "780448400",
        "daire": "16. Hukuk Dairesi",
        "esasNo": "2011/2924",
        "kararNo": "2011/1630",
        "kararTarihi": "15.03.2011",
        "arananKelime": "hukuk dairesi",
        "index": 40,
        "siraNo": 40,
        "kararMetni": "(Kapatılan)16. Hukuk Dairesi         2011/2924 E.  ,  2011/1630 K.\n\n\n\"İçtihat Metni\"\nMAHKEMESİ\t:ASLİYE HUKUK MAHKEMESİ\nDAVA TÜRÜ\t: ALACAK                                  \nDava, kooperatif hukukundan kaynaklanmakta olup, Asliye Hukuk Mahkemesince verilen hükmün temyizen incelenmesi görevi 11. Hukuk Dairesi Başkanlığına aittir. Bu nedenle dosyanın Yargıtay Yüksek 11. Hukuk Dairesi Başkanlığına GÖNDERİLMESİNE, 30.03.2011 gününde oybirliğiyle karar verildi."
    },
    {
        "id": "522293600",
        "daire": "23. Hukuk Dairesi",
        "esasNo": "2013/8431",
        "kararNo": "2013/7399",
        "kararTarihi": "25.11.2013",
        "arananKelime": "hukuk dairesi",
        "index": 41,
        "siraNo": 41,
        "kararMetni": "23. Hukuk Dairesi         2013/8431 E.  ,  2013/7399 K.\n\n\n\"İçtihat Metni\"\nMAHKEMESİ\t:Asliye Hukuk Mahkemesi\n-KARAR-\nTemyize konu iş bu dava dosyası, 11.06.2013 tarihinde Yargıtay 12. Hukuk Dairesi'nin aidiyet kararıyla Yargıtay 1. Hukuk Dairesi'ne gönderildiği, Yargıtay 1. Hukuk Dairesince de, 17.09.2013 tarihinde dosyanın temyiz incelemesinin 14. Hukuk Dairesi’nin görevine girdiği gerekçesiyle bu daireye gönderildiği anlaşılmıştır.\nYargıtay 14. Hukuk Dairesi’nce, Yargıtay Hukuk Daireleri Başkanlar Kurulu'nun 04.02.2010 tarih ve 3 sayılı kararı gereğince; dosyanın dördüncü bir daireye gönderilmeden iş bölümü uyuşmazlığının çözümü için doğrudan Hukuk Dairesi Başkanlar Kurulu'na gönderilmesi gerekirken, Dairemize gönderildiği anlaşıldığından dosyanın iş bölümü uyuşmazlığının çözümlenmesi için Hukuk Daireleri Başkanlar Kurulu’na gönderilmesi gerekmektedir.\nSONUÇ: Yukarıda açıklanan nedenlerle, dosyanın Hukuk Daireleri Başkanlar  Kurulu’na GÖNDERİLMESİNE, 25.11.2013 tarihinde oybirliğiyle karar verildi."
    },
    {
        "id": "605860200",
        "daire": "11. Hukuk Dairesi",
        "esasNo": "2012/11105",
        "kararNo": "2012/14148",
        "kararTarihi": "24.09.2012",
        "arananKelime": "hukuk dairesi",
        "index": 42,
        "siraNo": 42,
        "kararMetni": "11. Hukuk Dairesi         2012/11105 E.  ,  2012/14148 K.\n\n\n\"İçtihat Metni\"\nMAHKEMESİ\t:Sulh Hukuk Mahkemesi\nDava, hasımsız çek iptali istemine ilişkin ise de Sapanca Asliye Hukuk Mahkemesi ile Sapanca Sulh Hukuk Mahkemesi'nin temyiz olunmaksızın kesinleşen kararları uyarınca asliye ve sulh hukuk mahkemeleri arasında olumsuz görev uyuşmazlığı doğmuş olmakla uyuşmazlık görevli adli yargı yerinin belirlenmesine ilişkin olup, görevli daire Yüksek 17. Hukuk Dairesi olmakla dosyanın 17. Hukuk Dairesine gönderilmesine karar vermek gerekmiştir.\nSONUÇ : Yukarıdaki açıklanan nedenlerle, dosyanın Yüksek 17.  Hukuk Dairesi Başkanlığı’na GÖNDERİLMESİNE, 24.09.2012 tarihinde oybirliğiyle karar verildi."
    },
    {
        "id": "862291600",
        "daire": "16. Hukuk Dairesi",
        "esasNo": "2008/2243",
        "kararNo": "2008/1691",
        "kararTarihi": "20.03.2008",
        "arananKelime": "hukuk dairesi",
        "index": 43,
        "siraNo": 43,
        "kararMetni": "(Kapatılan)16. Hukuk Dairesi         2008/2243 E.  ,  2008/1691 K.\n\n\n\"İçtihat Metni\"\n \nMAHKEMESİ\t:ASLİYE HUKUK MAHKEMESİ\nDava, muhdesatın tespiti isteğine ilişkin olduğundan kararın temyizen incelenmesi görevi  2797 sayılı Yargıtay Kanunu'nun 14.maddesi uyarınca 7.Hukuk Dairesine ait olacağından 1.Hukuk Dairesinin 10.3.2008 tarihli kararı ile dosyanın 7.Hukuk Dairesi Başkanlığına gönderildiği, 7 ve 16.Hukuk Daireleri arasındaki tevzi sırasında dosyanın Dairemize tevzi edildiği anlaşılmıştır. İnceleme görevi 7.Hukuk Dairesine ait olan dosyanın Yargıtay Yüksek 7. Hukuk Dairesi Başkanlığı’na GÖNDERİLMESİNE, 20.3.2008 gününde oybirliği ile karar verildi."
    },
    {
        "id": "518750100",
        "daire": "19. Hukuk Dairesi",
        "esasNo": "2018/1520",
        "kararNo": "2019/2012",
        "kararTarihi": "26.03.2019",
        "arananKelime": "hukuk dairesi",
        "index": 44,
        "siraNo": 44,
        "kararMetni": "19. Hukuk Dairesi         2018/1520 E.  ,  2019/2012 K.\n\n\n\"İçtihat Metni\"\n19. HUKUK DAİRESİ     \nMAHKEMESİ             :Ticaret Mahkemesi\nSAYISI                        : 2014/831-2015/1260\n                                                                 - KARAR -\nİşbu dosya temyiz incelemesi için başlangıçta Dairemize gönderilmiş, 2016/3505 Esasa kaydedilmiştir. Dairemizin 2016/3505 Esas, 2016/3973 K. sayılı ve 07.03.2019 tarihli kararı ile uyuşmazlığın hurda maddelerden poliüretan maddelerinin ayrıştırılması işini konu alan eser sözleşmesinden kaynaklandığı tespit edilerek temyiz incelemesinin Yargıtay 15. Hukuk Dairesinin görevi dahilinde olduğu belirtilip dosya Yargıtay Hukuk İşbölümü İnceleme Kurulu’na gönderilmiştir. \nYargıtay Hukuk İşbölümü İnceleme Kurulu’nun 2016/21108 E. 2016/19088 K. sayılı kararıyla dosyanın temyiz incelemesi yapılmak üzere Yargıtay 15. Hukuk Dairesine gönderilmesine karar verilmiştir. Yargıtay 15. Hukuk Dairesi geri çevirme yaptıktan sonra sanki dosya kendisine Hukuk İşbölümü İnceleme Kurulu tarafından gönderilmemiş ve ilk defa temyiz incelemesi yapılması için Dairelerine gelmiş gibi dosya  Dairemize gönderilmiştir.\n Hukuk daireleri arasındaki görev uyuşmazlıklarında Hukuk İşbölümü İnceleme Kurulu tarafından verilen karar kesindir. Bu itibarla dosyanın Yargıtay 15. Hukuk Dairesi'ne gönderilmesini teminen Hukuk İşbölümü Kurulu'na gönderilmesi gerekmiştir. \nSONUÇ:Yukarıda açıklanan nedenlerle dosyanın Hukuk İşbölümü Kurulu'na GÖNDERİLMESİNE,  26/03/2019 gününde oybirliğiyle karar verildi."
    },
    {
        "id": "706871000",
        "daire": "13. Hukuk Dairesi",
        "esasNo": "2012/23192",
        "kararNo": "2012/21465",
        "kararTarihi": "01.10.2012",
        "arananKelime": "hukuk dairesi",
        "index": 45,
        "siraNo": 45,
        "kararMetni": "(Kapatılan) 13. Hukuk Dairesi         2012/23192 E.  ,  2012/21465 K.\n\n\n\"İçtihat Metni\"\nMAHKEMESİ:Asliye Hukuk Mahkemesi\n \n KARAR\nHukuk Daireleri Başkanlar Kurulu tarafından, dava dosyasının temyiz incelemisi yapılmak üzere 19.Hukuk Dairesi görevlendirilmiş olup, dosyanın temyiz incelemesini yapmakla görevli 19.Hukuk Dairesine gönderilmesine.SONUÇ:Dosyanın görevli Yargıtay Yüksek 19.Hukuk Dairesi Başkanlığına GÖNDERİLMESİNE, 1.10.2012 gününde oybirliğiyle karar verildi."
    },
    {
        "id": "960551400",
        "daire": "3. Hukuk Dairesi",
        "esasNo": "2010/19441",
        "kararNo": "2011/1652",
        "kararTarihi": "03.02.2011",
        "arananKelime": "hukuk dairesi",
        "index": 46,
        "siraNo": 46,
        "kararMetni": "3. Hukuk Dairesi         2010/19441 E.  ,  2011/1652 K.\n\n\n\"İçtihat Metni\"\nMAHKEMESİ\t:ASLİYE HUKUK MAHKEMESİ\n \nUyuşmazlık, Kooperatifler Kanunundan kaynaklanmakta olup, Yargıtay 13. Hukuk Dairesi ve 11. Hukuk Dairesi tarafından görevsizlik karar verilmiştir. \nİnceleme görevi Yargıtay Hukuk Başkanlar Kuruluna aittir.  Bu itibarla dosyanın gerekli incelemeyi yapacak daireyi belirlemek üzere Hukuk Başkanlar kuruluna gönderilmesine, 3.2.2011 gününde oybirliğiyle karar verildi."
    },
    {
        "id": "587838600",
        "daire": "14. Hukuk Dairesi",
        "esasNo": "2018/3800",
        "kararNo": "2020/2726",
        "kararTarihi": "05.03.2020",
        "arananKelime": "hukuk dairesi",
        "index": 47,
        "siraNo": 47,
        "kararMetni": "14. Hukuk Dairesi         2018/3800 E.  ,  2020/2726 K.\n\n\n\"İçtihat Metni\"\n14. Hukuk Dairesi\nMAHKEMESİ\t:Asliye Hukuk Mahkemesi\n \nKARAR\n Dava, evlatlık iddiası ile tapu iptali ve tescil istemine ilişkin olup, mahkemece verilen ilk karar Yargıtay 8. Hukuk Dairesine ilişkin olup, ikinci karar Yargıtay 8. Hukuk Dairesi tarafından bozulmuş olup, işbölümünün evlat edinme davalarına bakmakla ilgili bölümü gereğince davada görevli olan Yargıtay 8. Hukuk Dairesidir.  \n2797 sayılı Yargıtay  Kanununun 60/3. maddesi gereğince, Yargıtay Büyük Genel Kurulunun Hukuk Dairelerinin işbölümünü düzenleyen 23.01.2020  tarihli ve  2020/1 sayılı Kararına  ve davanın açıklanan niteliğine göre temyiz inceleme görevi Yargıtay  (8.)  Hukuk Dairesine ait bulunmaktadır.\nNe var ki; 8. Hukuk Dairesince de görevsizlik kararı verildiğinden  2797 sayılı Yargıtay Kanununun 60. maddesine göre görevli Dairenin belirlenmesi için dosyanın Yargıtay Hukuk İşbölümü İnceleme Kuruluna sunulması gerekmiştir. \nSONUÇ: Yukarıda açıklanan nedenlerle, görevli  Dairenin belirlenmesi için dosyanın Yargıtay Hukuk İşbölümü İnceleme Kuruluna GÖNDERİLMESİNE,  05/03/2020  tarihinde  oy birliğiyle karar verildi."
    },
    {
        "id": "667128700",
        "daire": "11. Hukuk Dairesi",
        "esasNo": "2011/15065",
        "kararNo": "2011/17061",
        "kararTarihi": "14.12.2011",
        "arananKelime": "hukuk dairesi",
        "index": 48,
        "siraNo": 48,
        "kararMetni": "11. Hukuk Dairesi         2011/15065 E.  ,  2011/17061 K.\n\n\n\"İçtihat Metni\"\nMAHKEMESİ\t:Asliye Hukuk Mahkemesi\nDava, taraflar arasındaki ortaklık ilişkisinin sona ermesinden sonra 25.01.2005 tarihli protokole göre borçlu olmadığının tespiti istemine ilişkin olup, Yargıtay 13. Hukuk Dairesi tarafından verilen 11.11.2010 tarihli bozma ilamı sonrası bozmaya uyularak karar verildiğine göre, dosyanın temyiz incelemesi Dairemiz görevi dışında kalmaktadır.\nYargıtay Büyük Genel Kurulu'nun 12.05.2011 gün ve 1 sayılı kararı uyarınca temyiz incelemesinin 13. Hukuk Dairesi'ce yapılmasına karar verildiğinden dosyanın Yargıtay Yüksek 13. Hukuk Dairesi Başkanlığı'na gönderilmesi gerekmiştir.\nAncak dosyanın Yargıtay 13. Hukuk Dairesi tarafından 4. Hukuk Dairesi'ne, 4. Hukuk Dairesi tarafından Dairemize gönderilmiş olup, görev uyuşmazlığının çözümü için dosyanın Yüksek Yargıtat Hukuk Başkanlar Kurulu'na gönderilmesi gerekmiştir.\nSONUÇ: Yukarıda açıklanan nedenlerle Dairemizin görevsizliğine, dosyanın Yüksek Yargıtay Hukuk Başkanlar Kurulu’na sunulmak üzere Yargıtay Birinci Başkanlığı’na GÖNDERİLMESİNE,  14.12.2011 tarihinde oybirliğiyle karar verildi."
    },
    {
        "id": "140237000",
        "daire": "3. Hukuk Dairesi",
        "esasNo": "2014/9180",
        "kararNo": "2015/2063",
        "kararTarihi": "11.02.2015",
        "arananKelime": "hukuk dairesi",
        "index": 49,
        "siraNo": 49,
        "kararMetni": "3. Hukuk Dairesi         2014/9180 E.  ,  2015/2063 K.\n\n\n\"İçtihat Metni\"\nMAHKEMESİ\t: BİGA ASLİYE HUKUK MAHKEMESİ\nTARİHİ\t: 11/12/2012\nNUMARASI\t: 2009/990-2012/542\nDavada asıl istem, ecrmisil alacağına ilişkindir.  \nDavanın  niteliğine göre inceleme görevi Yargıtay 1.Hukuk Dairesinindir.\nNe var ki, dosya Yargıtay 14.Hukuk Dairesi tarafından görevsizlikle 8.Hukuk Dairesine, 8.Hukuk Dairesi'de görevsizlikle Dairemize göndermiş olduğundan; dosyanın Hukuk Daireleri Başkanlar Kurulunca temyiz incelemesini yapacak daire belirtilmek üzere dosyanın Hukuk Daireleri Başkanlar Kuruluna gönderilmesine, 11.02.2015 gününde  oybirliğiyle karar verildi."
    },
    {
        "id": "793751900",
        "daire": "18. Hukuk Dairesi",
        "esasNo": "2013/399",
        "kararNo": "2013/1865",
        "kararTarihi": "14.02.2013",
        "arananKelime": "hukuk dairesi",
        "index": 50,
        "siraNo": 50,
        "kararMetni": "(Kapatılan) 18. Hukuk Dairesi         2013/399 E.  ,  2013/1865 K.\n\n\n\"İçtihat Metni\"\nMAHKEMESİ\t:Asliye Hukuk Mahkemesi\nY A R G I T A Y   K A R A R I\nDava dosyasının incelenmesinde;\n13. Hukuk Dairesince uyuşmazlığın mülkiyet hakkı ile ilgili bulunduğu gerekçesiyle 14.12.2009 tarihinde 1. Hukuk Dairesine gönderilmiştir.\n 1. Hukuk Dairesince uyuşmazlığın zilyetliğe dayalı tapu iptali ve tescil istemine ilişkin bulunduğu gerekçesiyle 28.12.2009 tarihinde 8. Hukuk Dairesine gönderilmiştir.\n8.Hukuk Dairesince 24.05.2010 tarihinde uyuşmazlığın 2942 sayılı Yasanın 38. maddesine dayalı bulunduğu gerekçesiyle 18. Hukuk Dairesine gönderilmiştir.\n18. Hukuk Dairesi 20.06.2011 tarihinde davanın 1051 sayılı Yasa uyarınca kamulaştırılarak Hazine adına tescil edilen taşınmazın tapusunun iptali istemine ilişkin bulunması bu nedenle inceleme görevinin 5. Hukuk Dairesi olduğu ancak daha önceden değişik Dairelerce incelendiği gözetilerek görevli dairenin belirlenmesi amacıyla Yargıtay Birinci Başkanlığına gönderilmiştir.\nYargıtay Hukuk Daireleri Başkanlar Kurulunca 15.12.2011 tarihinde uyuşmazlığın zilyetliğe dayalı tapu iptali ve tescil istemine ilişkin bulunması nedeniyle görevli Dairenin 8. Hukuk Dairesi olduğu belirtilerek 8. Hukuk Dairesine gönderilmiştir.\n8. Hukuk Dairesince bu defa 25.12.2012 tarihinde uyuşmazlığın Kamulaştırma Kanunundan kaynaklanan tapu iptali ve tescil istemine ilişkin bulunduğu ve 09.02.2012 gün 1 sayılı Yargıtay Büyük Genel Kurul kararıyla  belirlenen iş bölümüne ilişkin kararı gerekçe gösterilerek 18. Hukuk Dairesine yeniden gönderilmiştir.\n2797 Sayılı Yargıtay Kanununun 17. maddesinin 1/a bendi gereğince uyuşmazlığın çözümünde Yargıtay 8. Hukuk Dairesi görevlendirilmiştir.\n Ancak, anılan Daire dosyayı Dairemize göndermiş bulunduğundan  Başkanlar Kurulunca gereğinin takdir ve ifası için dosyanın Yüksek Birinci Başkanlığa gönderilmesine, 14.02.2013 gününde oybirliğiyle karar verildi."
    },
    {
        "id": "608396900",
        "daire": "11. Hukuk Dairesi",
        "esasNo": "2011/4143",
        "kararNo": "2012/5262",
        "kararTarihi": "03.04.2012",
        "arananKelime": "hukuk dairesi",
        "index": 51,
        "siraNo": 51,
        "kararMetni": "11. Hukuk Dairesi         2011/4143 E.  ,  2012/5262 K.\n\n\n\"İçtihat Metni\"\nMAHKEMESİ\t:Sulh Hukuk Mahkemesi\nTaraflar arasındaki davadan dolayı Ayancık Sulh Hukuk Mahkemesi'nce verilen hükmün Yargıtay'ca incelenmesi vekili tarafından istenilmekle, dosyadaki kağıtlar okundu, gereği konuşulup düşünüldü:\nDava, Kooperatifler Kanununundan doğan itirazın iptali istemine ilişkindir.\nUyuşmazlığın niteliğine açıklanan bu niteliğine ve tarafların sıfatına göre kararın temyiz inceleme görevi Yüksek Yargıtay 23. Hukuk Dairesi Başkanlığı'na aittir. Ancak dosyanın Yargıtay 12. Hukuk Dairesi Başkanlığı tarafından 13. Hukuk Dairesi Başkanlığı'na, 13. Hukuk Dairesi Başkanlığı tarafından 3. Hukuk Dairesi Başkanlığı'na, 3. Hukuk Dairesi Başkanlığı tarafından görevsizlikle Dairemize gönderildiği anlaşılmıştır. Dördüncü defa verilen gönderme kararı nedeniyle oluşan aidiyet uyuşmazlığının giderilmesi için dosyanın Yüksek Başkanlar Kuruluna gönderilmesine karar vermek gerekmiştir.\nSONUÇ: Yukarıda açıklanan nedenlerle, dosyanın Yargıtay Başkanlar Kuruluna sunulmak üzere Yargıtay Yüksek 1. Başkanlığı'na gönderilmesine, 03.04.2012 tarihinde oybirliğiyle karar verildi."
    },
    {
        "id": "475616100",
        "daire": "3. Hukuk Dairesi",
        "esasNo": "2014/3737",
        "kararNo": "2014/10489",
        "kararTarihi": "26.06.2014",
        "arananKelime": "hukuk dairesi",
        "index": 52,
        "siraNo": 52,
        "kararMetni": "3. Hukuk Dairesi         2014/3737 E.  ,  2014/10489 K.\n\n\n\"İçtihat Metni\"\nMAHKEMESİ:TİCARET MAHKEMESİ\nUyuşmazlık, bayilik sözleşmesine dayalı alacak istemine ilişkindir.\nUyuşmazlığın niteliğine, tarafların sıfatına ve emsal dosyalara ilişkin Yargıtay 19.Hukuk Dairesinin kararları (Yargıtay 19.Hukuk Dairesinin 2013/17394 Esas 2014/2089 Karar sayılı ilamı Yargıtay 19.Hukuk Dairesinin 2011/1926 Esas 2011/11013 Karar sayılı ilamı; Yargıtay 19.Hukuk Dairesinin 2011/1890 Esas 2011/11010 Karar sayılı yargılama dosyalarının) temyiz incelemesi Yüksek Yargıtay 19.Hukuk Dairesi Başkanlığınca yapılmıştır.Davanın  niteliğine göre inceleme görevi Yargıtay 4.Hukuk Dairesinindir.Ancak, temyiz istemine konu yargılama dosyasında 11.Hukuk Dairesi ve 19.Hukuk Dairelerince verilmiş görevsizlik kararının bulunduğu anlaşılmakla 04.02.2010 tarih ve 3 sayılı Yargıtay Başkanlar Kurulu kararı gereğince; dosyanın Hukuk Daireleri Başkanlar Kurulunca temyiz incelemesini yapacak daire belirtilmek üzere dosyanın Hukuk Daireleri Başkanlar Kuruluna gönderilmesine,  26.06.2014 gününde oybirliğiyle karar verildi."
    },
    {
        "id": "813801200",
        "daire": "19. Hukuk Dairesi",
        "esasNo": "2010/12572",
        "kararNo": "2010/12493",
        "kararTarihi": "04.11.2010",
        "arananKelime": "hukuk dairesi",
        "index": 53,
        "siraNo": 53,
        "kararMetni": "(Kapatılan)19. Hukuk Dairesi         2010/12572 E.  ,  2010/12493 K.\n\n\n\"İçtihat Metni\"\nMahkemesi\t:Sulh Hukuk Mahkemesi \n- K A R A R -\nUyuşmazlığın tacirler arası haksız fiilden kaynaklanması ve taraflar arasında abonelik sözleşmesinin bulunmaması nedeniyle temyiz incelemesi ile görevli Yüksek 7. Hukuk Dairesidir. Ne var ki dosya sırasıyla Dairemize 13 Hukuk Dairesi, 4.Hukuk Dairesi ve 3.Hukuk Dairesi'nden geldiği için olumsuz görev uyuşmazlığının Hukuk Daireleri Başkanlar Kurulu'nca çözümlenmesi gerekir. \t\nSONUÇ : Yukarıda açıklanan nedenlerle dosyanın Yüksek 1.Başkanlığa sunulmasına, 04.112010 gününde oybirliğiyle karar verildi."
    },
    {
        "id": "442633500",
        "daire": "9. Hukuk Dairesi",
        "esasNo": "2013/6382",
        "kararNo": "2013/20398",
        "kararTarihi": "04.07.2013",
        "arananKelime": "hukuk dairesi",
        "index": 54,
        "siraNo": 54,
        "kararMetni": "9. Hukuk Dairesi         2013/6382 E.  ,  2013/20398 K.\n\n\n\"İçtihat Metni\"\n \nMAHKEMESİ\t:ASLİYE HUKUK (İŞ) MAHKEMESİ\n                                                  Y A R G I T A Y     K A R A R I \nYargıtay Başkanlar Kurulu'nun 21.01.2013 günlü kararı ile; \n9 ncu Hukuk Dairesi arşivinde bulunan dosyaların süratle eritilmesi amacıyla; \na) Bu iş bölümünün yürürlüğe girdiği tarihten itibaren 7 nci, 9 uncu ve 22 inci Hukuk Dairelerine gönderilen ve ortak görevli bulundukları dosyaların tamamı, 12.000 sayısına ulaşana kadar 7 nci Hukuk Dairesi esasına kaydedilir ve temyiz incelemesi bu daire tarafından yapılır. \nb) 12.000 dosya tamamlandıktan sonra, takip eden ve 7 nci Hukuk Dairesinin görevli olduğu grup dışındaki mahkemelerden gelecek 24.000 dosya 22 nci Hukuk Dairesi esasına kaydedilir ve temyiz incelemesi bu daire tarafından yapılır. \nKuralı gereğince Yargıtay 1. Hukuk Dairesi'nin gönderme kararı tarihi itibariyle İş Hukukundan kaynaklanan alacak taleplerinin temyiz incelemesi Yargıtay 22. Hukuk Dairesi'ne verilmiştir.\nSONUÇ: Taraflar arasındaki uyuşmazlığın İş Hukukundan kaynaklanması ve Yargıtay Başkanlar Kurulu'nun anılan kararına göre dosyanın Yargıtay 22. Hukuk Dairesi'ne GÖNDERİLMESİNE, 04.07.2013 tarihinde oybirliğiyle karar verildi."
    },
    {
        "id": "442742200",
        "daire": "9. Hukuk Dairesi",
        "esasNo": "2013/6375",
        "kararNo": "2013/19784",
        "kararTarihi": "27.06.2013",
        "arananKelime": "hukuk dairesi",
        "index": 55,
        "siraNo": 55,
        "kararMetni": "9. Hukuk Dairesi         2013/6375 E.  ,  2013/19784 K.\n\n\n\"İçtihat Metni\"\nMAHKEMESİ\t:ASLİYE HUKUK(İŞ) MAHKEMESİ\n                                                  Y A R G I T A Y     K A R A R I \n\tYargıtay Başkanlar Kurulu'nun 21.01.2013 günlü kararı ile; \n\t9 ncu Hukuk Dairesi arşivinde bulunan dosyaların süratle eritilmesi amacıyla; \n\ta) Bu işbölümünün yürürlüğe girdiği tarihten itibaren 7 nci, 9 uncu ve 22 inci Hukuk Dairelerine gönderilen ve ortak görevli bulundukları dosyaların tamamı, 12.000 sayısına ulaşana kadar 7 nci Hukuk Dairesi esasına kaydedilir ve temyiz incelemesi bu daire tarafından yapılır. \n\tb) 12.000 dosya tamamlandıktan sonra, takip eden ve 7 nci Hukuk Dairesinin görevli olduğu grup dışındaki mahkemelerden gelecek 24.000 dosya 22 nci Hukuk Dairesi esasına kaydedilir ve temyiz incelemesi bu daire tarafından yapılır. \n\tKuralı gereğince Yargıtay 19. Hukuk Dairesi'nin gönderme kararı tarihi itibariyle İş Hukukundan kaynaklanan menfi tespit taleplerinin temyiz incelemesi Yargıtay 22. Hukuk Dairesi'ne verilmiştir.\n\tSONUÇ: Taraflar arasındaki uyuşmazlığın İş Hukukundan kaynaklanması ve Yargıtay Başkanlar Kurulu'nun anılan kararına göre dosyanın Yargıtay 22. Hukuk Dairesi'ne GÖNDERİLMESİNE, 27.06.2013 tarihinde oybirliğiyle karar verildi."
    },
    {
        "id": "442739200",
        "daire": "9. Hukuk Dairesi",
        "esasNo": "2013/6372",
        "kararNo": "2013/19778",
        "kararTarihi": "27.06.2013",
        "arananKelime": "hukuk dairesi",
        "index": 56,
        "siraNo": 56,
        "kararMetni": "9. Hukuk Dairesi         2013/6372 E.  ,  2013/19778 K.\n\n\n\"İçtihat Metni\"\nMAHKEMESİ\t:ASLİYE HUKUK (İŞ) MAHKEMESİ\n                                                  Y A R G I T A Y     K A R A R I \n\tYargıtay Başkanlar Kurulu'nun 21.01.2013 günlü kararı ile; \n\t9 ncu Hukuk Dairesi arşivinde bulunan dosyaların süratle eritilmesi amacıyla; \n\ta) Bu işbölümünün yürürlüğe girdiği tarihten itibaren 7 nci, 9 uncu ve 22 inci Hukuk Dairelerine gönderilen ve ortak görevli bulundukları dosyaların tamamı, 12.000 sayısına ulaşana kadar 7 nci Hukuk Dairesi esasına kaydedilir ve temyiz incelemesi bu daire tarafından yapılır. \n\tb) 12.000 dosya tamamlandıktan sonra, takip eden ve 7 nci Hukuk Dairesinin görevli olduğu grup dışındaki mahkemelerden gelecek 24.000 dosya 22 nci Hukuk Dairesi esasına kaydedilir ve temyiz incelemesi bu daire tarafından yapılır. \n\tKuralı gereğince Yargıtay 19. Hukuk Dairesi'nin gönderme kararı tarihi itibariyle İş Hukukundan kaynaklanan menfi tespit taleplerinin temyiz incelemesi Yargıtay 22. Hukuk Dairesi'ne verilmiştir.\n\tSONUÇ: Taraflar arasındaki uyuşmazlığın İş Hukukundan kaynaklanması ve Yargıtay Başkanlar Kurulu'nun anılan kararına göre dosyanın Yargıtay 22. Hukuk Dairesi'ne GÖNDERİLMESİNE, 27.06.2013 tarihinde oybirliğiyle karar verildi."
    },
    {
        "id": "442737800",
        "daire": "9. Hukuk Dairesi",
        "esasNo": "2013/6371",
        "kararNo": "2013/19777",
        "kararTarihi": "27.06.2013",
        "arananKelime": "hukuk dairesi",
        "index": 57,
        "siraNo": 57,
        "kararMetni": "9. Hukuk Dairesi         2013/6371 E.  ,  2013/19777 K.\n\n\n\"İçtihat Metni\"\nMAHKEMESİ\t:ASLİYE HUKUK(İŞ) MAHKEMESİ\n                                                  Y A R G I T A Y     K A R A R I \n\tYargıtay Başkanlar Kurulu'nun 21.01.2013 günlü kararı ile; \n\t9 ncu Hukuk Dairesi arşivinde bulunan dosyaların süratle eritilmesi amacıyla; \n\ta) Bu işbölümünün yürürlüğe girdiği tarihten itibaren 7 nci, 9 uncu ve 22 inci Hukuk Dairelerine gönderilen ve ortak görevli bulundukları dosyaların tamamı, 12.000 sayısına ulaşana kadar 7 nci Hukuk Dairesi esasına kaydedilir ve temyiz incelemesi bu daire tarafından yapılır. \n\tb) 12.000 dosya tamamlandıktan sonra, takip eden ve 7 nci Hukuk Dairesinin görevli olduğu grup dışındaki mahkemelerden gelecek 24.000 dosya 22 nci Hukuk Dairesi esasına kaydedilir ve temyiz incelemesi bu daire tarafından yapılır. \n\tKuralı gereğince Yargıtay 19. Hukuk Dairesi'nin gönderme kararı tarihi itibariyle İş Hukukundan kaynaklanan menfi tespit taleplerinin temyiz incelemesi Yargıtay 22. Hukuk Dairesi'ne verilmiştir.\n\tSONUÇ: Taraflar arasındaki uyuşmazlığın İş Hukukundan kaynaklanması ve Yargıtay Başkanlar Kurulu'nun anılan kararına göre dosyanın Yargıtay 22. Hukuk Dairesi'ne GÖNDERİLMESİNE, 27.06.2013 tarihinde oybirliğiyle karar verildi."
    },
    {
        "id": "747170200",
        "daire": "3. Hukuk Dairesi",
        "esasNo": "2022/2156",
        "kararNo": "2022/2951",
        "kararTarihi": "30.03.2022",
        "arananKelime": "hukuk dairesi",
        "index": 58,
        "siraNo": 58,
        "kararMetni": "3. Hukuk Dairesi         2022/2156 E.  ,  2022/2951 K.\n\n\n\"İçtihat Metni\"\nMAHKEMESİ\t: İSTANBUL BÖLGE ADLİYE MAHKEMESİ 16. HUKUK DAİRESİ\nDosyanın yapılan ön incelemesinde; 11. Hukuk Dairesince yapılan ön inceleme sonucunda dosyanın, işbölümüne göre temyiz incelemesiyle görevli olduğu düşünülen 4. Hukuk Dairesine gönderildiği; bunun üzerine ön inceleme yapan 4. Hukuk Dairesince dosyanın, işbölümüne göre inceleme görevinin 3. Hukuk Dairesine ait olduğu belirtilerek Dairemize gönderildiği görülmüştür.\n2797 sayılı Yargıtay Kanunun 60.maddesinin 3.fıkrası gereği, temyiz incelemesi yapılmak üzere dosya kendisine gönderilen ilgili hukuk dairesi, 1 ay içinde yapacağı ön inceleme sonucunda iş bölümü bakımından kendisini görevli görmez ise gerekçesiyle birlikte dosyayı görevli olduğu kanısına vardığı ilgili hukuk dairesine; gönderme kararı üzerine dosya kendisine gelen hukuk dairesi ise 2 hafta içinde yapacağı ön inceleme sonucunda görevli olmadığı kanaatindeyse dosyayı Hukuk İşbölümü İnceleme Kuruluna gönderir. \nBuna göre, dosyanın temyiz incelemesi yapacak dairenin belirlenmesi için Hukuk İşbölümü İnceleme Kuruluna gönderilmesi gerekirken sehven Dairemize gönderildiği anlaşılmakla dosyanın YK m.60/3 gereği Hukuk İşbölümü İnceleme Kuruluna gönderilmesine 30/03/2022 günü oy birliğiyle karar verildi."
    },
    {
        "id": "608247200",
        "daire": "11. Hukuk Dairesi",
        "esasNo": "2011/15407",
        "kararNo": "2012/7325",
        "kararTarihi": "08.05.2012",
        "arananKelime": "hukuk dairesi",
        "index": 59,
        "siraNo": 59,
        "kararMetni": "11. Hukuk Dairesi         2011/15407 E.  ,  2012/7325 K.\n\n\n\"İçtihat Metni\"\nMAHKEMESİ\t:Sulh Hukuk Mahkemesi\nTaraflar arasındaki uyuşmazlık, kira sözleşmesinden kaynaklanan hor kullanma tazminatının tahsiline ilişkindir.  \nUyuşmazlığın açıklana bu niteliğine ve tarafların sıfatına kararın temyiz inceleme görevi Yüksek Yargıtay 6. Hukuk Dairesi Başkanlığına aittir. Ancak dosyanın Yargıtay 14. Hukuk Dairesi Başkanlığı tarafından 6. Hukuk Dairesi Başkanlığı'na, 6. Hukuk Dairesi Başkanlığı tarafından 3. Hukuk Dairesi Başkanlığı'na, 3. Hukuk Dairesi Başkanlığı tarafından görevsizlikle Dairemize gönderildiği anlaşılmıştır. Dördüncü defa verilen gönderme kararı nedeniyle oluşan aidiyet uyuşmazlığının giderilmesi için dosyanın Yüksek Başkanlar Kuruluna gönderilmesine karar vermek gerekmiştir.\nSONUÇ: Yukarıda açıklanan nedenlerle, dosyanın Başkanlar Kurulu’na sunulmak üzere Yargıtay Yüksek Birinci Başkanlığı’na GÖNDERİLMESİNE, 08.05.2012 tarihinde oybirliğiyle karar verildi."
    },
    {
        "id": "331340900",
        "daire": "2. Hukuk Dairesi",
        "esasNo": "2017/2701",
        "kararNo": "2017/5616",
        "kararTarihi": "08.05.2017",
        "arananKelime": "hukuk dairesi",
        "index": 60,
        "siraNo": 60,
        "kararMetni": "2. Hukuk Dairesi         2017/2701 E.  ,  2017/5616 K.\n\n\n\"İçtihat Metni\"\nMAHKEMESİ\t      :Asliye Hukuk Mahkemesi\nDAVA TÜRÜ\t      : Tapu Tptali ve Tescil\nTaraflar arasındaki davanın yapılan muhakemesi sonunda mahalli mahkemece verilen, yukarıda tarihi ve numarası gösterilen hüküm davacı tarafından temyiz edilmekle, evrak okunup gereği görüşülüp düşünüldü:\nTaraflar arasında görülmekte olan tapu iptal ve tescil davası nedeniyle Asliye Hukuk Mahkemesince verilen karar davacı tarafından temyiz edilmekle, Yargıtay 1. Hukuk Dairesi 15.07.2015 tarihinde dosyayı inceleme görevinin Yargıtay 14. Hukuk Dairesine ait olduğunu bildirerek, görevli Daireyi belirlemek üzere dosyayı Yargıtay Hukuk İşbölümü İnceleme Kuruluna göndermiş, Yargıtay Hukuk İşbölümü İnceleme Kurulu 24.11.2015 tarihli ilamı ile dosyayı inceleme görevinin Yargıtay 14. Hukuk Dairesine ait olduğuna karar vermiştir. 2797 sayılı Yargıtay Kanununun 60. maddesi gereği Yargıtay Hukuk İşbölümü İnceleme Kurulu tarafından verilen işbölümüne ilişkin karar kesindir. Bu husus gözetilmeden, Yargıtay 14. Hukuk Dairesi tarafından 12.04.2017 tarihli kararı ile dosyanın inceleme görevinin Yargıtay 2. Hukuk Dairesine ait olduğuna karar verilerek, dosyanın Dairemize gönderilmiş olduğu anlaşılmakla, dosyanın Yargıtay 14. Hukuk Dairesine geri gönderilmesine karar vermek gerekmiştir.\n     SONUÇ: Yargıtay Hukuk İşbölümü İnceleme Kurulunun 24.11.2015 tarihli kararının kesin olduğu gözetilerek, dosyanın Yargıtay 14. Hukuk Dairesine görderilmesine   oybirliğiyle karar verildi.08.05.2017 (Pzt.)"
    },
    {
        "id": "572496800",
        "daire": "13. Hukuk Dairesi",
        "esasNo": "2013/22103",
        "kararNo": "2013/20174",
        "kararTarihi": "02.09.2013",
        "arananKelime": "hukuk dairesi",
        "index": 61,
        "siraNo": 61,
        "kararMetni": "13. Hukuk Dairesi         2013/22103 E.  ,  2013/20174 K.\n\n\n\"İçtihat Metni\"\nMAHKEMESİ\t:Asliye Hukuk Mahkemesi\n                         KARAR\nDavanın tarafları arasındaki temel ilişkinin kambiyo hukukundan kaynaklanmasına, kambiyo hukukundan kaynaklı olarak görülen davada verilen kararın temyiz incelemesinin 19.Hukuk Dairesince yapılmış bulunmasına göre kararın temyizen incelenmesi görevi 19.Hukuk Dairesinne aittir.\n   SONUÇ: Dosyanın görevli Yargıtay Yüksek 19.Hukuk Dairesi Başkanlığına GÖNDERİLMESİNE, 2.9.2013 gününde oybirliğiyle karar verildi."
    },
    {
        "id": "293346300",
        "daire": "3. Hukuk Dairesi",
        "esasNo": "2013/21070",
        "kararNo": "2014/8342",
        "kararTarihi": "27.05.2014",
        "arananKelime": "hukuk dairesi",
        "index": 62,
        "siraNo": 62,
        "kararMetni": "3. Hukuk Dairesi         2013/21070 E.  ,  2014/8342 K.\n\n\n\"İçtihat Metni\"\nMAHKEMESİ\t: ASLİYE HUKUK MAHKEMESİ\nUyuşmazlık, davacının üyesi olduğu kooperatifin yaptığı protokol gereğince verilen bononun tahsiline ilişkin olup, 13.Hukuk Dairesi ve 18.Hukuk Dairesince görevsizlik kararı verilmiştir.\nDavanın  niteliğine göre inceleme görevi Yargıtay 13.Hukuk Dairesinindir.\nDosyanın Hukuk Daireleri Başkanlar Kurulunca temyiz incelemesini yapacak daire belirtilmek üzere Hukuk Daireleri Başkanlar Kuruluna gönderilmesine, 27.05.2014 gününde  oybirliğiyle karar verildi."
    },
    {
        "id": "293341000",
        "daire": "3. Hukuk Dairesi",
        "esasNo": "2013/21072",
        "kararNo": "2014/8344",
        "kararTarihi": "27.05.2014",
        "arananKelime": "hukuk dairesi",
        "index": 63,
        "siraNo": 63,
        "kararMetni": "3. Hukuk Dairesi         2013/21072 E.  ,  2014/8344 K.\n\n\n\"İçtihat Metni\"\nMAHKEMESİ\t: ASLİYE HUKUK MAHKEMESİ\nUyuşmazlık, davacının üyesi olduğu kooperatifin yaptığı protokol gereğince verilen bononun tahsiline ilişkin olup, 13.Hukuk Dairesi ve 18.Hukuk Dairesince görevsizlik kararı verilmiştir.\nDavanın  niteliğine göre inceleme görevi Yargıtay 13.Hukuk Dairesinindir.\nDosyanın Hukuk Daireleri Başkanlar Kurulunca temyiz incelemesini yapacak daire belirtilmek üzere Hukuk Daireleri Başkanlar Kuruluna gönderilmesine, 27.05.2014 gününde  oybirliğiyle karar verildi."
    },
    {
        "id": "293343300",
        "daire": "3. Hukuk Dairesi",
        "esasNo": "2013/21071",
        "kararNo": "2014/8343",
        "kararTarihi": "27.05.2014",
        "arananKelime": "hukuk dairesi",
        "index": 64,
        "siraNo": 64,
        "kararMetni": "3. Hukuk Dairesi         2013/21071 E.  ,  2014/8343 K.\n\n\n\"İçtihat Metni\"\nMAHKEMESİ\t: ASLİYE HUKUK MAHKEMESİ\nUyuşmazlık, davacının üyesi olduğu kooperatifin yaptığı protokol gereğince verilen bononun tahsiline ilişkin olup, 13.Hukuk Dairesi ve 18.Hukuk Dairesince görevsizlik kararı verilmiştir.\nDavanın  niteliğine göre inceleme görevi Yargıtay 13.Hukuk Dairesinindir.\nDosyanın Hukuk Daireleri Başkanlar Kurulunca temyiz incelemesini yapacak daire belirtilmek üzere Hukuk Daireleri Başkanlar Kuruluna gönderilmesine, 27.05.2014 gününde  oybirliğiyle karar verildi."
    },
    {
        "id": "293338200",
        "daire": "3. Hukuk Dairesi",
        "esasNo": "2013/21073",
        "kararNo": "2014/8345",
        "kararTarihi": "27.05.2014",
        "arananKelime": "hukuk dairesi",
        "index": 65,
        "siraNo": 65,
        "kararMetni": "3. Hukuk Dairesi         2013/21073 E.  ,  2014/8345 K.\n\n\n\"İçtihat Metni\"\nMAHKEMESİ\t: ASLİYE HUKUK MAHKEMESİ\n \n \nUyuşmazlık, davacının üyesi olduğu kooperatifin yaptığı protokol gereğince verilen bononun tahsiline ilişkin olup, 13.Hukuk Dairesi ve 18.Hukuk Dairesince görevsizlik kararı verilmiştir.\nDavanın  niteliğine göre inceleme görevi Yargıtay 13.Hukuk Dairesinindir.\nDosyanın Hukuk Daireleri Başkanlar Kurulunca temyiz incelemesini yapacak daire belirtilmek üzere Hukuk Daireleri Başkanlar Kuruluna gönderilmesine, 27.05.2014 gününde  oybirliğiyle karar verildi."
    },
    {
        "id": "289395000",
        "daire": "3. Hukuk Dairesi",
        "esasNo": "2013/20839",
        "kararNo": "2014/5185",
        "kararTarihi": "01.04.2014",
        "arananKelime": "hukuk dairesi",
        "index": 66,
        "siraNo": 66,
        "kararMetni": "3. Hukuk Dairesi         2013/20839 E.  ,  2014/5185 K.\n\n\n\"İçtihat Metni\"\nMAHKEMESİ\t:ASLİYE HUKUK MAHKEMESİ\nUyuşmazlık, davacının üyesi olduğu kooperatifin yaptığı protokol gereğince verilen bononun tahsiline ilişkin olup, 13.Hukuk Dairesi ve 18.Hukuk Dairesince görevsizlik kararı verilmişitr.\nDavanın  niteliğine göre inceleme görevi Yargıtay 13.Hukuk Dairesinindir.\nDosyanın Hukuk Daireleri Başkanlar Kurulunca temyiz incelemesini yapacak daire belirtilmek üzere Hukuk Daireleri Başkanlar Kuruluna gönderilmesine, 01.04.2014 gününde  oybirliğiyle karar verildi."
    },
    {
        "id": "289395100",
        "daire": "3. Hukuk Dairesi",
        "esasNo": "2013/20838",
        "kararNo": "2014/5184",
        "kararTarihi": "01.04.2014",
        "arananKelime": "hukuk dairesi",
        "index": 67,
        "siraNo": 67,
        "kararMetni": "3. Hukuk Dairesi         2013/20838 E.  ,  2014/5184 K.\n\n\n\"İçtihat Metni\"\nMAHKEMESİ\t:ASLİYE HUKUK MAHKEMESİ\nUyuşmazlık, davacının üyesi olduğu kooperatifin yaptığı protokol gereğince verilen bononun tahsiline ilişkin olup, 13.Hukuk Dairesi ve 18.Hukuk Dairesince görevsizlik kararı verilmişitr.\nDavanın  niteliğine göre inceleme görevi Yargıtay 13.Hukuk Dairesinindir.\nDosyanın Hukuk Daireleri Başkanlar Kurulunca temyiz incelemesini yapacak daire belirtilmek üzere Hukuk Daireleri Başkanlar Kuruluna gönderilmesine, 01.04.2014 gününde  oybirliğiyle karar verildi."
    },
    {
        "id": "290302000",
        "daire": "3. Hukuk Dairesi",
        "esasNo": "2013/20835",
        "kararNo": "2014/5784",
        "kararTarihi": "10.04.2014",
        "arananKelime": "hukuk dairesi",
        "index": 68,
        "siraNo": 68,
        "kararMetni": "3. Hukuk Dairesi         2013/20835 E.  ,  2014/5784 K.\n\n\n\"İçtihat Metni\"\nMAHKEMESİ\t:ASLİYE HUKUK MAHKEMESİ\nUyuşmazlık, davacının üyesi olduğu kooperatifin yaptığı protokol gereğince verilen bononun tahsiline ilişkin olup, 13.Hukuk Dairesi ve 18.Hukuk Dairesince görevsizlik kararı verilmişitr.\nDavanın  niteliğine göre inceleme görevi Yargıtay 13.Hukuk Dairesinindir.\nDosyanın Hukuk Daireleri Başkanlar Kurulunca temyiz incelemesini yapacak daire belirtilmek üzere Hukuk Daireleri Başkanlar Kuruluna gönderilmesine, 10.04.2014 tarihinde oybirliğiyle karar verildi."
    },
    {
        "id": "290301100",
        "daire": "3. Hukuk Dairesi",
        "esasNo": "2013/20834",
        "kararNo": "2014/5785",
        "kararTarihi": "10.04.2014",
        "arananKelime": "hukuk dairesi",
        "index": 69,
        "siraNo": 69,
        "kararMetni": "3. Hukuk Dairesi         2013/20834 E.  ,  2014/5785 K.\n\n\n\"İçtihat Metni\"\nMAHKEMESİ\t:ASLİYE HUKUK MAHKEMESİ\nUyuşmazlık, davacının üyesi olduğu kooperatifin yaptığı protokol gereğince verilen bononun tahsiline ilişkin olup, 13.Hukuk Dairesi ve 18.Hukuk Dairesince görevsizlik kararı verilmişitr.\nDavanın  niteliğine göre inceleme görevi Yargıtay 13.Hukuk Dairesinindir.\nDosyanın Hukuk Daireleri Başkanlar Kurulunca temyiz incelemesini yapacak daire belirtilmek üzere Hukuk Daireleri Başkanlar Kuruluna gönderilmesine, 10.04.2014 gününde  oybirliğiyle karar verildi."
    },
    {
        "id": "290043300",
        "daire": "3. Hukuk Dairesi",
        "esasNo": "2013/20829",
        "kararNo": "2014/5638",
        "kararTarihi": "08.04.2014",
        "arananKelime": "hukuk dairesi",
        "index": 70,
        "siraNo": 70,
        "kararMetni": "3. Hukuk Dairesi         2013/20829 E.  ,  2014/5638 K.\n\n\n\"İçtihat Metni\"\nMAHKEMESİ\t:ASLİYE HUKUK MAHKEMESİ\nUyuşmazlık, davacının üyesi olduğu kooperatifin yaptığı protokol gereğince verilen bononun tahsiline ilişkin olup, 13.Hukuk Dairesi ve 18.Hukuk Dairesince görevsizlik kararı verilmişitr.\nDavanın  niteliğine göre inceleme görevi Yargıtay 13.Hukuk Dairesinindir.\nDosyanın Hukuk Daireleri Başkanlar Kurulunca temyiz incelemesini yapacak daire belirtilmek üzere Hukuk Daireleri Başkanlar Kuruluna gönderilmesine, 08.04.2014 tarihinde oybirliğiyle karar verildi."
    },
    {
        "id": "290044000",
        "daire": "3. Hukuk Dairesi",
        "esasNo": "2013/20828",
        "kararNo": "2014/5637",
        "kararTarihi": "08.04.2014",
        "arananKelime": "hukuk dairesi",
        "index": 71,
        "siraNo": 71,
        "kararMetni": "3. Hukuk Dairesi         2013/20828 E.  ,  2014/5637 K.\n\n\n\"İçtihat Metni\"\nMAHKEMESİ\t:ASLİYE HUKUK MAHKEMESİ\nUyuşmazlık, davacının üyesi olduğu kooperatifin yaptığı protokol gereğince verilen bononun tahsiline ilişkin olup, 13.Hukuk Dairesi ve 18.Hukuk Dairesince görevsizlik kararı verilmişitr.\nDavanın  niteliğine göre inceleme görevi Yargıtay 13.Hukuk Dairesinindir.\nDosyanın Hukuk Daireleri Başkanlar Kurulunca temyiz incelemesini yapacak daire belirtilmek üzere Hukuk Daireleri Başkanlar Kuruluna gönderilmesine, 08.04.2014 tarihinde oybirliğiyle karar verildi."
    },
    {
        "id": "290041700",
        "daire": "3. Hukuk Dairesi",
        "esasNo": "2013/20833",
        "kararNo": "2014/5679",
        "kararTarihi": "08.04.2014",
        "arananKelime": "hukuk dairesi",
        "index": 72,
        "siraNo": 72,
        "kararMetni": "3. Hukuk Dairesi         2013/20833 E.  ,  2014/5679 K.\n\n\n\"İçtihat Metni\"\nMAHKEMESİ\t:ASLİYE HUKUK MAHKEMESİ\nUyuşmazlık, davacının üyesi olduğu kooperatifin yaptığı protokol gereğince verilen bononun tahsiline ilişkin olup, 13.Hukuk Dairesi ve 18.Hukuk Dairesince görevsizlik kararı verilmişitr.\nDavanın  niteliğine göre inceleme görevi Yargıtay 13.Hukuk Dairesinindir.\nDosyanın Hukuk Daireleri Başkanlar Kurulunca temyiz incelemesini yapacak daire belirtilmek üzere Hukuk Daireleri Başkanlar Kuruluna gönderilmesine, 08.04.2014 gününde  oybirliğiyle karar verildi."
    },
    {
        "id": "289395400",
        "daire": "3. Hukuk Dairesi",
        "esasNo": "2013/20837",
        "kararNo": "2014/5183",
        "kararTarihi": "01.04.2014",
        "arananKelime": "hukuk dairesi",
        "index": 73,
        "siraNo": 73,
        "kararMetni": "3. Hukuk Dairesi         2013/20837 E.  ,  2014/5183 K.\n\n\n\"İçtihat Metni\"\nMAHKEMESİ\t:ASLİYE HUKUK MAHKEMESİ\nUyuşmazlık, davacının üyesi olduğu kooperatifin yaptığı protokol gereğince verilen bononun tahsiline ilişkin olup, 13.Hukuk Dairesi ve 18.Hukuk Dairesince görevsizlik kararı verilmişitr.\nDavanın  niteliğine göre inceleme görevi Yargıtay 13.Hukuk Dairesinindir.\nDosyanın Hukuk Daireleri Başkanlar Kurulunca temyiz incelemesini yapacak daire belirtilmek üzere Hukuk Daireleri Başkanlar Kuruluna gönderilmesine, 01.04.2014 gününde  oybirliğiyle karar verildi."
    },
    {
        "id": "290042900",
        "daire": "3. Hukuk Dairesi",
        "esasNo": "2013/20830",
        "kararNo": "2014/5639",
        "kararTarihi": "08.04.2014",
        "arananKelime": "hukuk dairesi",
        "index": 74,
        "siraNo": 74,
        "kararMetni": "3. Hukuk Dairesi         2013/20830 E.  ,  2014/5639 K.\n\n\n\"İçtihat Metni\"\nMAHKEMESİ\t:ASLİYE HUKUK MAHKEMESİ\nUyuşmazlık, davacının üyesi olduğu kooperatifin yaptığı protokol gereğince verilen bononun tahsiline ilişkin olup, 13.Hukuk Dairesi ve 18.Hukuk Dairesince görevsizlik kararı verilmişitr.\nDavanın  niteliğine göre inceleme görevi Yargıtay 13.Hukuk Dairesinindir.\nDosyanın Hukuk Daireleri Başkanlar Kurulunca temyiz incelemesini yapacak daire belirtilmek üzere Hukuk Daireleri Başkanlar Kuruluna gönderilmesine, 08.04.2014 gününde  oybirliğiyle karar verildi."
    },
    {
        "id": "290042300",
        "daire": "3. Hukuk Dairesi",
        "esasNo": "2013/20831",
        "kararNo": "2014/5678",
        "kararTarihi": "08.04.2014",
        "arananKelime": "hukuk dairesi",
        "index": 75,
        "siraNo": 75,
        "kararMetni": "3. Hukuk Dairesi         2013/20831 E.  ,  2014/5678 K.\n\n\n\"İçtihat Metni\"\nMAHKEMESİ\t:ASLİYE HUKUK MAHKEMESİ\nUyuşmazlık, davacının üyesi olduğu kooperatifin yaptığı protokol gereğince verilen bononun tahsiline ilişkin olup, 13.Hukuk Dairesi ve 18.Hukuk Dairesince görevsizlik kararı verilmişitr.\nDavanın  niteliğine göre inceleme görevi Yargıtay 13.Hukuk Dairesinindir.\nDosyanın Hukuk Daireleri Başkanlar Kurulunca temyiz incelemesini yapacak daire belirtilmek üzere Hukuk Daireleri Başkanlar Kuruluna gönderilmesine,  08.04.2014 tarihinde oybirliğiyle karar verildi."
    },
    {
        "id": "290042700",
        "daire": "3. Hukuk Dairesi",
        "esasNo": "2013/20832",
        "kararNo": "2014/5677",
        "kararTarihi": "08.04.2014",
        "arananKelime": "hukuk dairesi",
        "index": 76,
        "siraNo": 76,
        "kararMetni": "3. Hukuk Dairesi         2013/20832 E.  ,  2014/5677 K.\n\n\n\"İçtihat Metni\"\nMAHKEMESİ\t:ASLİYE HUKUK MAHKEMESİ\nUyuşmazlık, davacının üyesi olduğu kooperatifin yaptığı protokol gereğince verilen bononun tahsiline ilişkin olup, 13.Hukuk Dairesi ve 18.Hukuk Dairesince görevsizlik kararı verilmişitr.\nDavanın  niteliğine göre inceleme görevi Yargıtay 13.Hukuk Dairesinindir.\nDosyanın Hukuk Daireleri Başkanlar Kurulunca temyiz incelemesini yapacak daire belirtilmek üzere Hukuk Daireleri Başkanlar Kuruluna gönderilmesine, 08.04.2014 tarihinde oybirliğiyle karar verildi."
    },
    {
        "id": "290299800",
        "daire": "3. Hukuk Dairesi",
        "esasNo": "2013/20836",
        "kararNo": "2014/5786",
        "kararTarihi": "10.04.2014",
        "arananKelime": "hukuk dairesi",
        "index": 77,
        "siraNo": 77,
        "kararMetni": "3. Hukuk Dairesi         2013/20836 E.  ,  2014/5786 K.\n\n\n\"İçtihat Metni\"\nMAHKEMESİ\t:ASLİYE HUKUK MAHKEMESİ\nUyuşmazlık, davacının üyesi olduğu kooperatifin yaptığı protokol gereğince verilen bononun tahsiline ilişkin olup, 13.Hukuk Dairesi ve 18.Hukuk Dairesince görevsizlik kararı verilmişitr.\nDavanın  niteliğine göre inceleme görevi Yargıtay 13.Hukuk Dairesinindir.\nDosyanın Hukuk Daireleri Başkanlar Kurulunca temyiz incelemesini yapacak daire belirtilmek üzere Hukuk Daireleri Başkanlar Kuruluna gönderilmesine, 10.04.2014 gününde  oybirliğiyle karar verildi."
    },
    {
        "id": "292788300",
        "daire": "3. Hukuk Dairesi",
        "esasNo": "2013/21069",
        "kararNo": "2014/8341",
        "kararTarihi": "27.05.2014",
        "arananKelime": "hukuk dairesi",
        "index": 78,
        "siraNo": 78,
        "kararMetni": "3. Hukuk Dairesi         2013/21069 E.  ,  2014/8341 K.\n\n\n\"İçtihat Metni\"\nMAHKEMESİ\t: ASLİYE HUKUK MAHKEMESİ\nUyuşmazlık, davacının üyesi olduğu kooperatifin yaptığı protokol gereğince verilen bononun tahsiline ilişkin olup, 13.Hukuk Dairesi ve 18.Hukuk Dairesince görevsizlik kararı verilmiştir.\nDavanın  niteliğine göre inceleme görevi Yargıtay 13.Hukuk Dairesinindir.\nDosyanın Hukuk Daireleri Başkanlar Kurulunca temyiz incelemesini yapacak daire belirtilmek üzere Hukuk Daireleri Başkanlar Kuruluna gönderilmesine, 27.05.2014 gününde  oybirliğiyle karar verildi."
    },
    {
        "id": "621520700",
        "daire": "13. Hukuk Dairesi",
        "esasNo": "2012/1626",
        "kararNo": "2012/1278",
        "kararTarihi": "27.01.2012",
        "arananKelime": "hukuk dairesi",
        "index": 79,
        "siraNo": 79,
        "kararMetni": "(Kapatılan) 13. Hukuk Dairesi         2012/1626 E.  ,  2012/1278 K.\n\n\n\"İçtihat Metni\"\n\tT.C.\n\tYARGITAY\n\t13. Hukuk Dairesi\nBoğazlıyan Sulh Hukuk Mahkemesi\nKARAR\nDava, kira sözleşmesinden kaynaklanan alacak istemine ilişkin olup, Sulh Hukuk Mahkemesince hükme bağlandığından kararın incelenmesi Yargıtay 3. Hukuk Dairesine aittir.\nSONUÇ: Dosyanın görevli Yargıtay Yüksek 3. Hukuk Dairesi Başkanlığına GÖNDERİLMESİNE, 27.1.2012 gününde oybirliğiyle karar verildi."
    },
    {
        "id": "656857900",
        "daire": "13. Hukuk Dairesi",
        "esasNo": "2012/4486",
        "kararNo": "2012/4929",
        "kararTarihi": "27.02.2012",
        "arananKelime": "hukuk dairesi",
        "index": 80,
        "siraNo": 80,
        "kararMetni": "(Kapatılan) 13. Hukuk Dairesi         2012/4486 E.  ,  2012/4929 K.\n\n\n\"İçtihat Metni\"\n\tT.C.\n\tYARGITAY\n\t13. Hukuk Dairesi\nMAHKEMESİ\t:Asliye Hukuk Mahkemesi\n\t\t\t\t\tKARAR\nDava, sigorta hukukundan doğduğundan, kararın temyizen incelenmesi görevi 2797 sayılı Yargıtay Kanunu'nun 14.maddesi uyarınca 11. Hukuk Dairesinindir.\nSONUÇ: Dosyanın görevli Yargıtay Yüksek 11. Hukuk Dairesi Başkanlığına GÖNDERİLMESİNE, 27.2.2011 gününde oybirliğiyle karar verildi."
    },
    {
        "id": "625147000",
        "daire": "13. Hukuk Dairesi",
        "esasNo": "2012/2267",
        "kararNo": "2012/2137",
        "kararTarihi": "06.02.2012",
        "arananKelime": "hukuk dairesi",
        "index": 81,
        "siraNo": 81,
        "kararMetni": "(Kapatılan) 13. Hukuk Dairesi         2012/2267 E.  ,  2012/2137 K.\n\n\n\"İçtihat Metni\"\n\tT.C.\n\tYARGITAY\n\t13. Hukuk Dairesi\n... 3. Asliye Hukuk Mahkemesi\nKARAR\nDava, kooperatif hukukundan kaynaklandığından kararın temyizen incelenmesi görevi 2797 sayılı Yargıtay Kanunu'nun 14.maddesi uyarınca 23.Hukuk Dairesinindir.\nSONUÇ: Dosyanın görevli Yargıtay Yüksek 23.Hukuk Dairesi Başkanlığına GÖNDERİLMESİNE, 06.02.2012 gününde oybirliğiyle karar verildi."
    },
    {
        "id": "624157100",
        "daire": "13. Hukuk Dairesi",
        "esasNo": "2012/2053",
        "kararNo": "2012/1334",
        "kararTarihi": "27.01.2012",
        "arananKelime": "hukuk dairesi",
        "index": 82,
        "siraNo": 82,
        "kararMetni": "(Kapatılan) 13. Hukuk Dairesi         2012/2053 E.  ,  2012/1334 K.\n\n\n\"İçtihat Metni\"\n\tT.C.\n\tYARGITAY\n\t13. Hukuk Dairesi\n... 2.Asliye Hukuk Mahkemesi\nKARAR\nDava sigorta hukukundan doğduğundan kararın  temyizen incelenmesi görevi 2797 sayılı Yargıtay Kanunu'nun 14.maddesi uyarınca 11. Hukuk Dairesinindir.\nSONUÇ: Dosyanın görevli Yargıtay Yüksek 11. Hukuk Dairesi Başkanlığına GÖNDERİLMESİNE, 27.1.2012 gününde oybirliğiyle karar verildi."
    },
    {
        "id": "624881800",
        "daire": "13. Hukuk Dairesi",
        "esasNo": "2012/2605",
        "kararNo": "2012/2186",
        "kararTarihi": "06.02.2012",
        "arananKelime": "hukuk dairesi",
        "index": 83,
        "siraNo": 83,
        "kararMetni": "(Kapatılan) 13. Hukuk Dairesi         2012/2605 E.  ,  2012/2186 K.\n\n\n\"İçtihat Metni\"\n\tT.C.\n\tYARGITAY\n\t13. Hukuk Dairesi\nElmalı Asliye Hukuk Mahkemesi\nKARAR\nDava, sigorta hukukundan doğduğundan, kararın temyizen incelenmesi görevi 2797 sayılı Yargıtay Kanunu'nun 14.maddesi uyarınca 11. Hukuk Dairesinindir.\nSONUÇ: Dosyanın görevli Yargıtay Yüksek 11. Hukuk Dairesi Başkanlığına GÖNDERİLMESİNE, 06.02.2012 gününde oybirliğiyle karar verildi."
    },
    {
        "id": "505179200",
        "daire": "23. Hukuk Dairesi",
        "esasNo": "2013/5586",
        "kararNo": "2013/5121",
        "kararTarihi": "06.09.2013",
        "arananKelime": "hukuk dairesi",
        "index": 84,
        "siraNo": 84,
        "kararMetni": "23. Hukuk Dairesi         2013/5586 E.  ,  2013/5121 K.\n\n\n\"İçtihat Metni\"\nMAHKEMESİ\t\t\t\t\t:Ticaret Mahkemesi\n- K A R A R -\nTemyize konu ... bu dava dosyasının, mahal mahkemesince ... .... Hukuk Dairesi'ne gönderildiği, bu daire tarafından ....06.2012 tarihinde ... .... Hukuk Dairesi'ne, ... .... Hukuk Dairesince de ....07.2012 tarihinde dosyanın temyiz incelemesinin .... Hukuk Dairesinin görevine girdiği gerekçesiyle bu daireye gönderildiği anlaşılmıştır.\n... .... Hukuk Dairesince, ... Hukuk Daireleri Başkanlar Kurulu'nun 04.02.2010 tarih ve ... sayılı kararı gereğince dosyanın dördüncü bir daireye gönderilmeden işbölümü uyuşmazlığının çözümü için doğrudan Hukuk Dairesi Başkanlar Kurulu'na gönderilmesi gerekirken, sehven tekrar Dairemize gönderildiği anlaşıldığından dosyanın işbölümü uyuşmazlığının  çözümlenmesi için  doğrudan  Hukuk Daireleri Başkanlar  Kuruluna gönderilmesi gerekmektedir.\nSONUÇ:Yukarıda açıklanan nedenlerle, dosyanın Hukuk Daireleri Başkanlar  Kuruluna GÖNDERİLMESİNE, 06.09.2013 tarihinde oybirliğiyle karar verildi."
    },
    {
        "id": "242863000",
        "daire": "4. Hukuk Dairesi",
        "esasNo": "2012/13693",
        "kararNo": "2013/1143",
        "kararTarihi": "28.01.2013",
        "arananKelime": "hukuk dairesi",
        "index": 85,
        "siraNo": 85,
        "kararMetni": "4. Hukuk Dairesi         2012/13693 E.  ,  2013/1143 K.\n\n\n\"İçtihat Metni\"\nMAHKEMESİ\t:Asliye Hukuk Mahkemesi\nYargıtay 14. Hukuk Dairesi görevli olduğundan bahisle dairemizce görevsizlik kararı verilmesine rağmen, Yargıtay 14. Hukuk Dairesi dosyayı Yargıtay Hukuk Daireleri Başkanlar Kuruluna göndermesi gerekirken görevsizlikle tekrar dairemize gönderdiğinden olumsuz görev uyuşmazlığının çözümü için dosyanın Yargıtay Hukuk Daireleri Başkanlar Kuruluna gönderilmesi gerekir.\n SONUÇ: Açıklanan nedenlerle, dosyanın Yargıtay Hukuk Daireleri Başkanlar Kuruluna gönderilmesine 28/01/2013 gününde oybirliğiyle karar verildi."
    },
    {
        "id": "264620300",
        "daire": "4. Hukuk Dairesi",
        "esasNo": "2012/18685",
        "kararNo": "2013/16898",
        "kararTarihi": "04.11.2013",
        "arananKelime": "hukuk dairesi",
        "index": 86,
        "siraNo": 86,
        "kararMetni": "4. Hukuk Dairesi         2012/18685 E.  ,  2013/16898 K.\n\n\n\"İçtihat Metni\"\nMAHKEMESİ            :Asliye Hukuk Mahkemesi\nUyuşmazlık sözleşmeye ilişkin bulunmasına göre temyiz inceleme görevi 13. Hukuk Dairesine aittir. Ne var ki 13. Hukuk Dairesince, davanın istisna sözleşmesinden kaynaklandığı belirtilerek, temyiz incelemesinin 15. Hukuk Dairesi tarafından yapılması gerektiğine karar verilmiştir. Bu kez 15. Hukuk Dairesi de uyuşmazlığın kişilik haklarına saldırı niteliğinde olduğunu kabul ederek, temyiz inceleme görevinin Dairemize ait bulunduğunu kararlaştırmıştır. Şu durumda temyiz incelemesini yapacak daireyi belirleme göreviYargıtay Hukuk Daireleri Başkanlar Kuruluna aittir.  \nSONUÇ: Açıklanan nedenlerle, temyiz incelemesini yapacak görevli dairenin belirlenmesi için dosyanın Yargıtay Hukuk Daireleri Başkanlar Kuruluna gönderilmesine 04/11/2013 gününde oybirliğiyle karar verildi."
    },
    {
        "id": "608240100",
        "daire": "11. Hukuk Dairesi",
        "esasNo": "2011/8265",
        "kararNo": "2012/7405",
        "kararTarihi": "09.05.2012",
        "arananKelime": "hukuk dairesi",
        "index": 87,
        "siraNo": 87,
        "kararMetni": "11. Hukuk Dairesi         2011/8265 E.  ,  2012/7405 K.\n\n\n\"İçtihat Metni\"\nMAHKEMESİ\t:Asliye Hukuk Mahkemesi\nTaraflar arasındaki uyuşmazlık, tacirler arası araç kiralama sözleşmesine dayalı fazla ödenen bedelin iadesi istemine ilişkin olup, uyuşmazlığın niteliğine göre, dosyanın temyiz incelemesi, Yargıtay  6.  Hukuk Dairesinin görevine girmektedir.\nAncak, dosya 17. Hukuk Dairesi Başkanlığı tarafından, 4. Hukuk Daire''sine, 4. Hukuk Dairesi tarafından da Daire'mize gönderildiğinden görev uyuşmazlığının çözüme için dosyanın Yüksek Yargıtay Hukuk Başkanlar Kuruluna sunulmak üzere Yargıtay Birinci Başkanlığı'na gönderilmesi gerekmiştir.\nSONUÇ : Yukarıdaki açıklanan nedenlerle, dosyanın görevli Yüksek Yargıtay  Hukuk Başkanlar Kurulu'na sunulmak üzere Yargıtay Birinci Başkanlığı’na GÖNDERİLMESİNE, 09.05.2012 tarihinde oybirliğiyle karar verildi."
    },
    {
        "id": "936304400",
        "daire": "3. Hukuk Dairesi",
        "esasNo": "2023/3692",
        "kararNo": "2023/2095",
        "kararTarihi": "10.07.2023",
        "arananKelime": "hukuk dairesi",
        "index": 88,
        "siraNo": 88,
        "kararMetni": "3. Hukuk Dairesi         2023/3692 E.  ,  2023/2095 K.\n\n\n\"İçtihat Metni\"\nMAHKEMESİ\t: Kayseri Bölge Adliye Mahkemesi 6. Hukuk Dairesi\nSAYISI\t: 2022/2148 E., 2022/2120 K.\nİLK DERECE MAHKEMESİ\t: ... Asliye Hukuk Mahkemesi\nSAYISI\t: 2021/87 E., 2022/257 K.\n2797 sayılı Yargıtay Kanunu’nun (2797 sayılı Kanun) 40 ıncı ve Yargıtay İç Yönetmeliği’nin  maddeleri uyarınca yapılan ön incelemede; Yargıtay 1. Hukuk Dairesince dosyanın, temyiz incelemesi yapmakla görevli olduğu düşünülen Yargıtay 7. Hukuk Dairesine gönderildiği; Yargıtay 7. Hukuk Dairesince ise temyiz inceleme görevinin Dairemize ait olduğu gerekçesiyle dosyanın Dairemize gönderildiği anlaşılmıştır.\n2797 sayılı Kanunun 60. maddesinin üçüncü fıkrası gereği, temyiz incelemesi yapılmak üzere dosya kendisine gönderilen ilgili hukuk dairesi, 1 ay içinde yapacağı ön inceleme sonucunda iş bölümü bakımından kendisini görevli ... ise gerekçesiyle birlikte dosyayı görevli olduğu kanısına vardığı ilgili hukuk dairesine; gönderme kararı üzerine dosya kendisine gelen hukuk dairesi ise 2 hafta içinde yapacağı ön inceleme sonucunda görevli olmadığı kanaatindeyse dosyayı Hukuk İşbölümü İnceleme Kuruluna gönderir. \nBuna göre dosyanın, Yargıtay 7. Hukuk Dairesince temyiz incelemesi yapacak dairenin belirlenmesi için Hukuk İşbölümü İnceleme Kuruluna gönderilmesi gerekirken Dairemize gönderildiği anlaşıldığından; dosyanın, 2797 sayılı Kanunun 60.maddesinin üçüncü fıkrası gereği Hukuk İşbölümü İnceleme Kuruluna gönderilmesine karar vermek gerekmiştir.\nKARAR\nAçıklanan sebeplerle;\nDosyanın YARGITAY HUKUK İŞBÖLÜMÜ İNCELEME KURULUNA GÖNDERİLMESİNE,\n10.07.2023 tarihinde oy birliğiyle karar verildi."
    },
    {
        "id": "936303900",
        "daire": "3. Hukuk Dairesi",
        "esasNo": "2023/3691",
        "kararNo": "2023/2094",
        "kararTarihi": "10.07.2023",
        "arananKelime": "hukuk dairesi",
        "index": 89,
        "siraNo": 89,
        "kararMetni": "3. Hukuk Dairesi         2023/3691 E.  ,  2023/2094 K.\n\n\n\"İçtihat Metni\"\nMAHKEMESİ\t: Konya Bölge Adliye Mahkemesi 5. Hukuk Dairesi\nSAYISI\t: 2022/38 E., 2022/1123 K.\nİLK DERECE MAHKEMESİ\t: ... 4. Asliye Hukuk Mahkemesi\nSAYISI\t: 2020/65 E., 2021/226 K.\n2797 sayılı Yargıtay Kanunu’nun (2797 sayılı Kanun) 40 ıncı ve Yargıtay İç Yönetmeliği’nin 18 ... maddeleri uyarınca yapılan ön incelemede; Yargıtay 1. Hukuk Dairesince dosyanın, temyiz incelemesi yapmakla görevli olduğu düşünülen Yargıtay 7. Hukuk Dairesine gönderildiği; Yargıtay 7. Hukuk Dairesince ise temyiz inceleme görevinin Dairemize ait olduğu gerekçesiyle dosyanın Dairemize gönderildiği anlaşılmıştır.\n2797 sayılı Kanunun 60. maddesinin üçüncü fıkrası gereği, temyiz incelemesi yapılmak üzere dosya kendisine gönderilen ilgili hukuk dairesi, 1 ay içinde yapacağı ön inceleme sonucunda iş bölümü bakımından kendisini görevli ... ise gerekçesiyle birlikte dosyayı görevli olduğu kanısına vardığı ilgili hukuk dairesine; gönderme kararı üzerine dosya kendisine gelen hukuk dairesi ise 2 hafta içinde yapacağı ön inceleme sonucunda görevli olmadığı kanaatindeyse dosyayı Hukuk İşbölümü İnceleme Kuruluna gönderir. \nBuna göre dosyanın, Yargıtay 7. Hukuk Dairesince temyiz incelemesi yapacak dairenin belirlenmesi için Hukuk İşbölümü İnceleme Kuruluna gönderilmesi gerekirken Dairemize gönderildiği anlaşıldığından dosyanın 2797 sayılı Kanunun 60.maddesinin üçüncü fıkrası gereği Hukuk İşbölümü İnceleme Kuruluna gönderilmesine karar vermek gerekmiştir.\nKARAR\nAçıklanan sebeplerle;\nDosyanın YARGITAY HUKUK İŞBÖLÜMÜ İNCELEME KURULUNA GÖNDERİLMESİNE,\n10.07.2023 tarihinde oy birliğiyle karar verildi."
    },
    {
        "id": "523019400",
        "daire": "19. Hukuk Dairesi",
        "esasNo": "2013/9422",
        "kararNo": "2013/13591",
        "kararTarihi": "11.09.2013",
        "arananKelime": "hukuk dairesi",
        "index": 90,
        "siraNo": 90,
        "kararMetni": "19. Hukuk Dairesi         2013/9422 E.  ,  2013/13591 K.\n\n\n\"İçtihat Metni\"\nMAHKEMESİ\t:Asliye Hukuk Mahkemesi\n- K A R A R -\nDava dosyası Dairemiz ile Yüksek 11. Hukuk Dairesi arasındaki olumsuz görev uyuşmazlığının çözümlenmesi için Hukuk Daireleri Başkanlar Kurulu'na gönderilmiş ve Hukuk Daireleri Başkanlar Kurulu'nun 27.12.2012 tarihli kararıyla Yüksek 11. Hukuk Dairesi'nin görevsizlik kararının kaldırılmasına ve dosyanın bu daireye gönderilmesine karar verilmiş olduğu halde anılan Yüksek Dairece dosyanın tekrar Dairemize görevsizlik kararı ile gönderildiği görüldüğünden Hukuk Daireleri Başkanlar Kurulu kararına göre görevli olduğu belirtilen Yüksek 11. Hukuk Dairesine dosyanın geri gönderilmesine karar vermek gerekmiştir.  \nSONUÇ : Yukarıda açıklanan nedenlerle dosyanın temyiz incelemesini yapmakla görevli Yüksek 11. Hukuk Dairesi Başkanlığına gönderilmesine, 11.09.2013 gününde oybirliğiyle karar verildi."
    },
    {
        "id": "813421300",
        "daire": "3. Hukuk Dairesi",
        "esasNo": "2022/6924",
        "kararNo": "2022/7172",
        "kararTarihi": "29.09.2022",
        "arananKelime": "hukuk dairesi",
        "index": 91,
        "siraNo": 91,
        "kararMetni": "3. Hukuk Dairesi         2022/6924 E.  ,  2022/7172 K.\n\n\n\"İçtihat Metni\"\nMAHKEMESİ\t: KONYA BÖLGE ADLİYE MAHKEMESİ 1. HUKUK DAİRESİ\n7. Hukuk Dairesinin 2022/4231 E.-4845 K. sayılı kararıyla davaya bakmakla görevli dairenin 1. Hukuk Dairesinin olduğu belirtilerek dosyanın 1. Hukuk Dairesine gönderilmesine karar verilmesinden sonra 1. Hukuk Dairesince verilen 2022/5928 E.-5828 K. sayılı karar ile dosyanın aidiyet nedeniyle Dairemize gönderildiği anlaşılmaktadır. 2797 sayılı Yargıtay Kanununun 60/3. maddesi gereği gönderme kararı üzere dosya kendisine gelen hukuk dairesi görevli olmadığı kanaatindeyse dosyayı görevli dairenin belirlenmesi için  dosyanın Hukuk İşbölümü İnceleme Kurulu'na gönderilmesi gerekir.\nBu itibarla dosyanın gerekli inceleme yapılmak üzere Hukuk İşbölümü İnceleme Kurulu'na gönderilmesine, 29/09/2022 tarihinde  oy birliği ile karar verildi."
    },
    {
        "id": "867087800",
        "daire": "16. Hukuk Dairesi",
        "esasNo": "2006/6062",
        "kararNo": "2006/7761",
        "kararTarihi": "07.12.2006",
        "arananKelime": "hukuk dairesi",
        "index": 92,
        "siraNo": 92,
        "kararMetni": "(Kapatılan)16. Hukuk Dairesi         2006/6062 E.  ,  2006/7761 K.\n\n\n\"İçtihat Metni\"\n \nMAHKEMESİ\t:Asliye Hukuk Mahkemesi\n \nDosyanın Yargıtay 1.Hukuk Dairesinin 8.11.2006 tarihli ve 2006/8540-10842 sayılı kararı ile Yargıtay 17.Hukuk Dairesine gönderildiği, ancak sehven kadastro davalarına bakmakla görevli 7, 16 ve 17 Hukuk Daireleri arasında tevziye tabi tutularak Dairemize tevzi edildiği anlaşılmıştır. Dosyanın temyizen incelenmesi görevi 1.Hukuk Dairesinin anılan kararı uyarınca 17.Hukuk Dairesine aittir.\nBu nedenle dosyanın Yargıtay Yüksek 17.Hukuk Dairesi Başkanlığı’na GÖNDERİLMESİNE, 7.12.2006  gününde oybirliği ile karar verildi."
    },
    {
        "id": "245505900",
        "daire": "16. Hukuk Dairesi",
        "esasNo": "2013/153",
        "kararNo": "2013/135",
        "kararTarihi": "22.01.2013",
        "arananKelime": "hukuk dairesi",
        "index": 93,
        "siraNo": 93,
        "kararMetni": "16. Hukuk Dairesi         2013/153 E.  ,  2013/135 K.\n\n\n\"İçtihat Metni\"\nMAHKEMESİ\t:ASLİYE HUKUK MAHKEMESİ\nDAVA TÜRÜ\t: TAPU İPTALİ VE TESCİL\nKANUN YOLU         : TEMYİZ\nDavacı ... tarafından davalı ... aleyhinde açılan kadastro öncesi tapu kaydına dayalı kısmı tapu iptali ve tescil davasında verilen kararı temyizen inceleme konusunda Yargıtay 7. Hukuk Dairesi ile 1.Hukuk Dairesi arasında çıkan görev uyuşmazlığı nedeniyle Yargıtay Hukuk Daireleri Başkanlar Kurulu'nun 13.12.2012 tarih 2012/4175 Esas, 2012/4751 Karar sayılı ilamı ile Yargıtay 7. Hukuk Dairesi'nin görevsizlik kararının kaldırılarak dosyanın anılan Daireye gönderilmesine karar verilmiş olup, 7. Hukuk Dairesince dosyanın sehven dairemize gönderildiği anlaşıldığından, Yargıtay Hukuk Daireleri Başkanlar Kurulu kararı nedeniyle dosyanın Yüksek Yargıtay 7. Hukuk Dairesi Başkanlığı'na  GÖNDERİLMESİNE, 22.1.2013 günü oy birliği ile karar verildi."
    },
    {
        "id": "633494600",
        "daire": "11. Hukuk Dairesi",
        "esasNo": "2010/16251",
        "kararNo": "2012/4167",
        "kararTarihi": "19.03.2012",
        "arananKelime": "hukuk dairesi",
        "index": 94,
        "siraNo": 94,
        "kararMetni": "11. Hukuk Dairesi         2010/16251 E.  ,  2012/4167 K.\n\n\n\"İçtihat Metni\"\nMAHKEMESİ\t:Sulh Hukuk Mahkemesi\nDava, kooperatif tarafından davalının evinin bulunduğu kooperatif sahasında verilen hizmet karşılığı gider katılım payının tahsili amacıyla yapılan icra takibine itirazın iptali istemine ilişkin olup, davalı kooperatif üyesi değildir.\nYargıtay Büyük Genel Kurulu'nun 12.05.2011 gün ve 1 sayılı kararı uyarınca temyiz incelemesinin 23. Hukuk Dairesi'nce yapılmasına karar verildiğinden dosyanın Yargıtay Yüksek 23. Hukuk Dairesi Başkanlığı'na gönderilmesi gerekmiştir.\nAncak, anılan dosya 18. Hukuk Dairesi tarafından 3. Hukuk Dairesi'ne , 3. Hukuk Dairesi tarafından Dairemiz'e gönderilmiştir. Dairemizce de görevsizlik kararı verildiğinden, görev uyuşmazlığının çözümü için dosyanın Yüksek Yargıtay Hukuk Başkanlar Kurulu'na gönderilmesi gerekmiştir.\nSONUÇ : Dosyanın görev uyuşmazlığının çözümü için Yüksek Yargıtay Hukuk Başkanlar Kurulu'na  GÖNDERİLMESİNE, 19.03.2012 tarihinde oybirliğiyle karar verildi."
    },
    {
        "id": "121261700",
        "daire": "3. Hukuk Dairesi",
        "esasNo": "2014/7753",
        "kararNo": "2014/15884",
        "kararTarihi": "04.12.2014",
        "arananKelime": "hukuk dairesi",
        "index": 95,
        "siraNo": 95,
        "kararMetni": "3. Hukuk Dairesi         2014/7753 E.  ,  2014/15884 K.\n\n\n\"İçtihat Metni\"\nMAHKEMESİ\t: İSTANBUL ANADOLU 16. ASLİYE HUKUK MAHKEMESİ\nTARİHİ\t: 26/04/2012\nNUMARASI\t: 2010/500-2012/249\nUyuşmazlık, ecrimisil istemine ilişkin olup, mahkemenin hukuki nitelendirmesi de bu yöndedir.\nDavanın niteliğine göre inceleme görevi Yargıtay 1. Hukuk Dairesinindir.\nAncak 6. Hukuk Dairesi dosyayı 26.03.2013 tarihli ilamla 1. Hukuk Dairesine göndermiş, 1. Hukuk Dairesi 28.05.2013 tarihli ilamla dosyayı 6. Hukuk Dairesine göndermiş, 6. Hukuk Dairesi ise 31.03.2013 tarihli ilamla dosyayı dairemize göndermiş olduğundan Yargıtay Kanununun 17.maddesi gereğince toplanan Yargıtay Başkanlar Kurulunun 27.01.2011 tarih ve 2 sayılı kararı ile, Daireler arasında iş bölümünden kaynaklanan görevsizlik kararını inceleyen üçüncü Dairece yapılacak inceleme sonucunda görevsizlik kararı verilmesi halinde, dosyanın doğrudan Hukuk Başkanlar Kuruluna gönderilmesi gerektiğinden, yukarıda belirtilen Daireler arasında olumsuz görev uyuşmazlığının çözümlenmesi için dosyanın Hukuk Daireleri Başkanlar Kuruluna gönderilmesine, 04.12.2014 gününde  oybirliğiyle karar verildi."
    },
    {
        "id": "491053100",
        "daire": "9. Hukuk Dairesi",
        "esasNo": "2013/6139",
        "kararNo": "2013/16504",
        "kararTarihi": "30.05.2013",
        "arananKelime": "hukuk dairesi",
        "index": 96,
        "siraNo": 96,
        "kararMetni": "9. Hukuk Dairesi         2013/6139 E.  ,  2013/16504 K.\n\n\n\"İçtihat Metni\"\nMAHKEMESİ\t:ASLİYE HUKUK  MAHKEMESİ\n\tYargıtay Başkanlar Kurulu'nun 21.01.2013 günlü kararı ile; \n\t9 ncu Hukuk Dairesi arşivinde bulunan dosyaların süratle eritilmesi amacıyla; \n\ta) Bu işbölümünün yürürlüğe girdiği tarihten itibaren 7 nci, 9 uncu ve 22 inci Hukuk Dairelerine gönderilen ve ortak görevli bulundukları dosyaların tamamı, 12.000 sayısına ulaşana kadar 7 nci Hukuk Dairesi esasına kaydedilir ve temyiz incelemesi bu daire tarafından yapılır. \n\tb) 12.000 dosya tamamlandıktan sonra, takip eden ve 7 nci Hukuk Dairesinin görevli olduğu grup dışındaki mahkemelerden gelecek 24.000 dosya 22 nci Hukuk Dairesi esasına kaydedilir ve temyiz incelemesi bu daire tarafından yapılır. \n\tKuralı gereğince Yargıtay 12. Hukuk Dairesi'nin gönderme kararı tarihi itibariyle işçilik alacakları taleplerinin temyiz incelemesi Yargıtay 22. Hukuk Dairesi'ne verilmiştir.\n\tSONUÇ: Taraflar arasındaki uyuşmazlığın işçilik alacaklarından kaynaklanması ve Yargıtay Başkanlar Kurulu'nun anılan kararına göre dosyanın Yargıtay 22. Hukuk Dairesi'ne GÖNDERİLMESİNE, 30.05.2013 tarihinde oybirliğiyle karar verildi."
    },
    {
        "id": "491097600",
        "daire": "9. Hukuk Dairesi",
        "esasNo": "2013/5819",
        "kararNo": "2013/12386",
        "kararTarihi": "18.04.2013",
        "arananKelime": "hukuk dairesi",
        "index": 97,
        "siraNo": 97,
        "kararMetni": "9. Hukuk Dairesi         2013/5819 E.  ,  2013/12386 K.\n\n\n\"İçtihat Metni\"\nMAHKEMESİ\t:ASLİYE HUKUK (İŞ) MAHKEMESİ\nYargıtay Başkanlar Kurulu'nun 21.01.2013 günlü kararı ile; \n9 ncu Hukuk Dairesi arşivinde bulunan dosyaların süratle eritilmesi amacıyla; \na) Bu işbölümünün yürürlüğe girdiği tarihten itibaren 7 nci, 9 uncu ve 22 inci Hukuk Dairelerine gönderilen ve ortak görevli bulundukları dosyaların tamamı, 12.000 sayısına ulaşana kadar 7 nci Hukuk Dairesi esasına kaydedilir ve temyiz incelemesi bu daire tarafından yapılır. \nb) 12.000 dosya tamamlandıktan sonra, takip eden ve 7 nci Hukuk Dairesinin görevli olduğu grup dışındaki mahkemelerden gelecek 24.000 dosya 22 nci Hukuk Dairesi esasına kaydedilir ve temyiz incelemesi bu daire tarafından yapılır. \nKuralı gereğince 13. Hukuk Dairesi'nin gönderme kararı tarihi itibariyle işçilik alacakları taleplerinin temyiz incelemesi Yargıtay 7. Hukuk Dairesi'ne verilmiştir.\nSONUÇ: Taraflar arasındaki uyuşmazlığın işçilik alacaklarından kaynaklanması ve Yargıtay Başkanlar Kurulu'nun anılan kararına göre dosyanın Yargıtay 7. Hukuk Dairesi'ne GÖNDERİLMESİNE, 18.04.2013 tarihinde oybirliğiyle karar verildi."
    },
    {
        "id": "491051300",
        "daire": "9. Hukuk Dairesi",
        "esasNo": "2013/6134",
        "kararNo": "2013/16499",
        "kararTarihi": "30.05.2013",
        "arananKelime": "hukuk dairesi",
        "index": 98,
        "siraNo": 98,
        "kararMetni": "9. Hukuk Dairesi         2013/6134 E.  ,  2013/16499 K.\n\n\n\"İçtihat Metni\"\nMAHKEMESİ\t:ASLİYE  HUKUK  MAHKEMESİ\n\tYargıtay Başkanlar Kurulu'nun 21.01.2013 günlü kararı ile; \n\t9 ncu Hukuk Dairesi arşivinde bulunan dosyaların süratle eritilmesi amacıyla; \n\ta) Bu işbölümünün yürürlüğe girdiği tarihten itibaren 7 nci, 9 uncu ve 22 inci Hukuk Dairelerine gönderilen ve ortak görevli bulundukları dosyaların tamamı, 12.000 sayısına ulaşana kadar 7 nci Hukuk Dairesi esasına kaydedilir ve temyiz incelemesi bu daire tarafından yapılır. \n\tb) 12.000 dosya tamamlandıktan sonra, takip eden ve 7 nci Hukuk Dairesinin görevli olduğu grup dışındaki mahkemelerden gelecek 24.000 dosya 22 nci Hukuk Dairesi esasına kaydedilir ve temyiz incelemesi bu daire tarafından yapılır. \n\tKuralı gereğince Yargıtay 3. Hukuk Dairesi'nin gönderme kararı tarihi itibariyle işçilik alacakları taleplerinin temyiz incelemesi Yargıtay 22. Hukuk Dairesi'ne verilmiştir.\n\tSONUÇ: Taraflar arasındaki uyuşmazlığın işçilik alacaklarından kaynaklanması ve Yargıtay Başkanlar Kurulu'nun anılan kararına göre dosyanın Yargıtay 22. Hukuk Dairesi'ne GÖNDERİLMESİNE, 30.05.2013 tarihinde oybirliğiyle karar verildi."
    },
    {
        "id": "787023200",
        "daire": "16. Hukuk Dairesi",
        "esasNo": "2012/8890",
        "kararNo": "2012/11000",
        "kararTarihi": "18.12.2012",
        "arananKelime": "hukuk dairesi",
        "index": 99,
        "siraNo": 99,
        "kararMetni": "(Kapatılan)16. Hukuk Dairesi         2012/8890 E.  ,  2012/11000 K.\n\n\n\"İçtihat Metni\"\nMAHKEMESİ\t:SULH HUKUK MAHKEMESİ\n \nDava, zilyetliğin korunmasına ve tecavüzün önlenmesine ilişkin olup, dosyanın temyiz incelemesini yapmak görevi 8. Hukuk Dairesine ait bulunmaktadır. Ancak, dava dosyasının 1. Hukuk Dairesi Başkanlığının 8.2.2012 tarih, 2012/1127-898 sayılı kararı ile 8. Hukuk Dairesi Başkanlığına gönderildiği, 8. Hukuk Dairesi Başkanlığı tarafından ise 12.10.2012 tarih, 2012/1329-9148 sayılı karar ile dava dosyasının Dairemize gönderildiği anlaşılmakla, görevli Dairenin belirlenmesi için dosyanın Yargıtay Hukuk Daireleri Başkanlar Kuruluna GÖNDERİLMESİNE, 18.12.2012 gününde oybirliğiyle karar verildi."
    },
    {
        "id": "112912100",
        "daire": "23. Hukuk Dairesi",
        "esasNo": "2014/3319",
        "kararNo": "2014/2897",
        "kararTarihi": "14.04.2014",
        "arananKelime": "hukuk dairesi",
        "index": 100,
        "siraNo": 100,
        "kararMetni": "23. Hukuk Dairesi         2014/3319 E.  ,  2014/2897 K.\n\n\n\"İçtihat Metni\"\nMAHKEMESİ\t: Mut Asliye Hukuk Mahkemesi\nTARİHİ\t: 19/10/2012\nNUMARASI\t: 2012/270-2012/405\n-KARAR-\nTemyize konu iş bu dava dosyası, 24.05.2013 tarihinde Yargıtay 4. Hukuk Dairesi'nin aidiyet kararıyla Yargıtay 13. Hukuk Dairesi'ne gönderildiği, Yargıtay 13. Hukuk Dairesince de, 12.03.2014 tarihinde dosyanın temyiz incelemesinin 11. Hukuk Dairesi’nin görevine girdiği gerekçesiyle bu daireye gönderildiği anlaşılmıştır.\nYargıtay 11. Hukuk Dairesi’nce, Yargıtay Hukuk Daireleri Başkanlar Kurulu'nun 04.02.2010 tarih ve 3 sayılı kararı gereğince; dosyanın dördüncü bir daireye gönderilmeden iş bölümü uyuşmazlığının çözümü için doğrudan Hukuk Dairesi Başkanlar Kurulu'na gönderilmesi gerekirken, Dairemize gönderildiği anlaşıldığından dosyanın iş bölümü uyuşmazlığının çözümlenmesi için Hukuk Daireleri Başkanlar Kurulu’na gönderilmesi gerekmektedir.\nSONUÇ: Yukarıda açıklanan nedenlerle dosyanın Hukuk Daireleri Başkanlar  Kurulu’na GÖNDERİLMESİNE, 14.04.2014 tarihinde oybirliğiyle karar verildi."
    },
    {
        "id": "672428300",
        "daire": "15. Hukuk Dairesi",
        "esasNo": "2021/2410",
        "kararNo": "2021/5311",
        "kararTarihi": "01.07.2021",
        "arananKelime": "hukuk dairesi",
        "index": 1,
        "siraNo": 301,
        "kararMetni": "15. Hukuk Dairesi         2021/2410 E.  ,  2021/5311 K.\n\n\n\"İçtihat Metni\"\n HUKUK DAİRESİ\n... Birinci Başkanlık Kurulu'nun 22/06/2021 tarih, 196 sayılı kararı ve ... Kanunu'nun 10.maddesi gereğince yapılan daire kapatma ve birleştirme işlemleri sonucu 01.07.2021 tarihinden itibaren  . Hukuk Dairesi numarasının  . Hukuk Dairesi olarak değiştirilmesine karar verilmiştir.\n Bu nedenle iş bu dosyanın  . Hukuk Dairesine DEVRİNE ve esasın bu şekilde kapatılmasına karar verildi."
    },
    {
        "id": "672428500",
        "daire": "15. Hukuk Dairesi",
        "esasNo": "2021/1854",
        "kararNo": "2021/4801",
        "kararTarihi": "01.07.2021",
        "arananKelime": "hukuk dairesi",
        "index": 2,
        "siraNo": 302,
        "kararMetni": "15. Hukuk Dairesi         2021/1854 E.  ,  2021/4801 K.\n\n\n\"İçtihat Metni\"\n HUKUK DAİRESİ\n... Birinci Başkanlık Kurulu'nun 22/06/2021 tarih, 196 sayılı kararı ve ... Kanunu'nun 10.maddesi gereğince yapılan daire kapatma ve birleştirme işlemleri sonucu 01.07.2021 tarihinden itibaren  . Hukuk Dairesi numarasının  . Hukuk Dairesi olarak değiştirilmesine karar verilmiştir.\n Bu nedenle iş bu dosyanın  . Hukuk Dairesine DEVRİNE ve esasın bu şekilde kapatılmasına karar verildi."
    },
    {
        "id": "672424200",
        "daire": "15. Hukuk Dairesi",
        "esasNo": "2020/2601",
        "kararNo": "2021/3511",
        "kararTarihi": "01.07.2021",
        "arananKelime": "hukuk dairesi",
        "index": 3,
        "siraNo": 303,
        "kararMetni": "15. Hukuk Dairesi         2020/2601 E.  ,  2021/3511 K.\n\n\n\"İçtihat Metni\"\nHUKUK DAİRESİ\n... Birinci Başkanlık Kurulu'nun 22/06/2021 tarih, 196 sayılı kararı ve ... Kanunu'nun 10.maddesi gereğince yapılan daire kapatma ve birleştirme işlemleri sonucu 01.07.2021 tarihinden itibaren .... Hukuk Dairesi numarasının .... Hukuk Dairesi olarak değiştirilmesine karar verilmiştir.\n Bu nedenle iş bu dosyanın .... Hukuk Dairesine DEVRİNE ve esasın bu şekilde kapatılmasına karar verildi."
    },
    {
        "id": "672427900",
        "daire": "15. Hukuk Dairesi",
        "esasNo": "2021/3298",
        "kararNo": "2021/5797",
        "kararTarihi": "01.07.2021",
        "arananKelime": "hukuk dairesi",
        "index": 4,
        "siraNo": 304,
        "kararMetni": "15. Hukuk Dairesi         2021/3298 E.  ,  2021/5797 K.\n\n\n\"İçtihat Metni\"\n HUKUK DAİRESİ\n... Birinci Başkanlık Kurulu'nun 22/06/2021 tarih, 196 sayılı kararı ve ... Kanunu'nun 10.maddesi gereğince yapılan daire kapatma ve birleştirme işlemleri sonucu 01.07.2021 tarihinden itibaren  . Hukuk Dairesi numarasının  . Hukuk Dairesi olarak değiştirilmesine karar verilmiştir.\n Bu nedenle iş bu dosyanın  . Hukuk Dairesine DEVRİNE ve esasın bu şekilde kapatılmasına karar verildi."
    },
    {
        "id": "672427300",
        "daire": "15. Hukuk Dairesi",
        "esasNo": "2021/4264",
        "kararNo": "2021/6295",
        "kararTarihi": "01.07.2021",
        "arananKelime": "hukuk dairesi",
        "index": 5,
        "siraNo": 305,
        "kararMetni": "15. Hukuk Dairesi         2021/4264 E.  ,  2021/6295 K.\n\n\n\"İçtihat Metni\"\n HUKUK DAİRESİ\n... Birinci Başkanlık Kurulu'nun 22/06/2021 tarih, 196 sayılı kararı ve ... Kanunu'nun 10.maddesi gereğince yapılan daire kapatma ve birleştirme işlemleri sonucu 01.07.2021 tarihinden itibaren  . Hukuk Dairesi numarasının   . Hukuk Dairesi olarak değiştirilmesine karar verilmiştir.\n Bu nedenle iş bu dosyanın  . Hukuk Dairesine DEVRİNE ve esasın bu şekilde kapatılmasına karar verildi."
    },
    {
        "id": "672426600",
        "daire": "15. Hukuk Dairesi",
        "esasNo": "2021/5318",
        "kararNo": "2021/6945",
        "kararTarihi": "01.07.2021",
        "arananKelime": "hukuk dairesi",
        "index": 6,
        "siraNo": 306,
        "kararMetni": "15. Hukuk Dairesi         2021/5318 E.  ,  2021/6945 K.\n\n\n\"İçtihat Metni\"\n HUKUK DAİRESİ\n... Birinci Başkanlık Kurulu'nun 22/06/2021 tarih, 196 sayılı kararı ve ... Kanunu'nun 10.maddesi gereğince yapılan daire kapatma ve birleştirme işlemleri sonucu 01.07.2021 tarihinden itibaren  . Hukuk Dairesi numarasının  . Hukuk Dairesi olarak değiştirilmesine karar verilmiştir.\n Bu nedenle iş bu dosyanın  . Hukuk Dairesine DEVRİNE ve esasın bu şekilde kapatılmasına karar verildi."
    },
    {
        "id": "672427400",
        "daire": "15. Hukuk Dairesi",
        "esasNo": "2021/1742",
        "kararNo": "2021/4702",
        "kararTarihi": "01.07.2021",
        "arananKelime": "hukuk dairesi",
        "index": 7,
        "siraNo": 307,
        "kararMetni": "15. Hukuk Dairesi         2021/1742 E.  ,  2021/4702 K.\n\n\n\"İçtihat Metni\"\n HUKUK DAİRESİ\n... Birinci Başkanlık Kurulu'nun 22/06/2021 tarih, 196 sayılı kararı ve ... Kanunu'nun 10.maddesi gereğince yapılan daire kapatma ve birleştirme işlemleri sonucu 01.07.2021 tarihinden itibaren  . Hukuk Dairesi numarasının  . Hukuk Dairesi olarak değiştirilmesine karar verilmiştir.\n Bu nedenle iş bu dosyanın   . Hukuk Dairesine DEVRİNE ve esasın bu şekilde kapatılmasına karar verildi."
    },
    {
        "id": "672426700",
        "daire": "15. Hukuk Dairesi",
        "esasNo": "2021/3677",
        "kararNo": "2021/6002",
        "kararTarihi": "01.07.2021",
        "arananKelime": "hukuk dairesi",
        "index": 8,
        "siraNo": 308,
        "kararMetni": "15. Hukuk Dairesi         2021/3677 E.  ,  2021/6002 K.\n\n\n\"İçtihat Metni\"\nHUKUK DAİRESİ\n... Birinci Başkanlık Kurulu'nun 22/06/2021 tarih, 196 sayılı kararı ve ... Kanunu'nun 10.maddesi gereğince yapılan daire kapatma ve birleştirme işlemleri sonucu 01.07.2021 tarihinden itibaren  . Hukuk Dairesi numarasının  . Hukuk Dairesi olarak değiştirilmesine karar verilmiştir.\n Bu nedenle iş bu dosyanın  . Hukuk Dairesine DEVRİNE ve esasın bu şekilde kapatılmasına karar verildi."
    },
    {
        "id": "672426800",
        "daire": "15. Hukuk Dairesi",
        "esasNo": "2020/2459",
        "kararNo": "2021/4153",
        "kararTarihi": "01.07.2021",
        "arananKelime": "hukuk dairesi",
        "index": 9,
        "siraNo": 309,
        "kararMetni": "15. Hukuk Dairesi         2020/2459 E.  ,  2021/4153 K.\n\n\n\"İçtihat Metni\"\nHUKUK DAİRESİ\n... Birinci Başkanlık Kurulu'nun 22/06/2021 tarih, 196 sayılı kararı ve ... Kanunu'nun 10.maddesi gereğince yapılan daire kapatma ve birleştirme işlemleri sonucu 01.07.2021 tarihinden itibaren  . Hukuk Dairesi numarasının  . Hukuk Dairesi olarak değiştirilmesine karar verilmiştir.\n Bu nedenle iş bu dosyanın  . Hukuk Dairesine DEVRİNE ve esasın bu şekilde kapatılmasına karar verildi."
    },
    {
        "id": "672426500",
        "daire": "15. Hukuk Dairesi",
        "esasNo": "2021/215",
        "kararNo": "2021/3473",
        "kararTarihi": "01.07.2021",
        "arananKelime": "hukuk dairesi",
        "index": 10,
        "siraNo": 310,
        "kararMetni": "15. Hukuk Dairesi         2021/215 E.  ,  2021/3473 K.\n\n\n\"İçtihat Metni\"\n HUKUK DAİRESİ\n... Birinci Başkanlık Kurulu'nun 22/06/2021 tarih, 196 sayılı kararı ve ... Kanunu'nun 10.maddesi gereğince yapılan daire kapatma ve birleştirme işlemleri sonucu 01.07.2021 tarihinden itibaren  . Hukuk Dairesi numarasının  . Hukuk Dairesi olarak değiştirilmesine karar verilmiştir.\n Bu nedenle iş bu dosyanın   . Hukuk Dairesine DEVRİNE ve esasın bu şekilde kapatılmasına karar verildi."
    },
    {
        "id": "672427100",
        "daire": "15. Hukuk Dairesi",
        "esasNo": "2021/4261",
        "kararNo": "2021/6294",
        "kararTarihi": "01.07.2021",
        "arananKelime": "hukuk dairesi",
        "index": 11,
        "siraNo": 311,
        "kararMetni": "15. Hukuk Dairesi         2021/4261 E.  ,  2021/6294 K.\n\n\n\"İçtihat Metni\"\n HUKUK DAİRESİ\n... Birinci Başkanlık Kurulu'nun 22/06/2021 tarih, 196 sayılı kararı ve ... Kanunu'nun 10.maddesi gereğince yapılan daire kapatma ve birleştirme işlemleri sonucu 01.07.2021 tarihinden itibaren  . Hukuk Dairesi numarasının  . Hukuk Dairesi olarak değiştirilmesine karar verilmiştir.\n Bu nedenle iş bu dosyanın   . Hukuk Dairesine DEVRİNE ve esasın bu şekilde kapatılmasına karar verildi."
    },
    {
        "id": "672420500",
        "daire": "15. Hukuk Dairesi",
        "esasNo": "2021/1510",
        "kararNo": "2021/3931",
        "kararTarihi": "01.07.2021",
        "arananKelime": "hukuk dairesi",
        "index": 12,
        "siraNo": 312,
        "kararMetni": "15. Hukuk Dairesi         2021/1510 E.  ,  2021/3931 K.\n\n\n\"İçtihat Metni\"\nHUKUK DAİRESİ\n... Birinci Başkanlık Kurulu'nun 22/06/2021 tarih, 196 sayılı kararı ve ... Kanunu'nun 10.maddesi gereğince yapılan daire kapatma ve birleştirme işlemleri sonucu 01.07.2021 tarihinden itibaren . Hukuk Dairesi numarasının . Hukuk Dairesi olarak değiştirilmesine karar verilmiştir.\n Bu nedenle iş bu dosyanın . Hukuk Dairesine DEVRİNE ve esasın bu şekilde kapatılmasına karar verildi."
    },
    {
        "id": "672425100",
        "daire": "15. Hukuk Dairesi",
        "esasNo": "2021/5078",
        "kararNo": "2021/6939",
        "kararTarihi": "01.07.2021",
        "arananKelime": "hukuk dairesi",
        "index": 13,
        "siraNo": 313,
        "kararMetni": "15. Hukuk Dairesi         2021/5078 E.  ,  2021/6939 K.\n\n\n\"İçtihat Metni\"\nHUKUK DAİRESİ\n... Birinci Başkanlık Kurulu'nun 22/06/2021 tarih, 196 sayılı kararı ve ... Kanunu'nun 10.maddesi gereğince yapılan daire kapatma ve birleştirme işlemleri sonucu 01.07.2021 tarihinden itibaren  . Hukuk Dairesi numarasının  . Hukuk Dairesi olarak değiştirilmesine karar verilmiştir.\n Bu nedenle iş bu dosyanın  . Hukuk Dairesine DEVRİNE ve esasın bu şekilde kapatılmasına karar verildi."
    },
    {
        "id": "672425600",
        "daire": "15. Hukuk Dairesi",
        "esasNo": "2021/2451",
        "kararNo": "2021/5347",
        "kararTarihi": "01.07.2021",
        "arananKelime": "hukuk dairesi",
        "index": 14,
        "siraNo": 314,
        "kararMetni": "15. Hukuk Dairesi         2021/2451 E.  ,  2021/5347 K.\n\n\n\"İçtihat Metni\"\n HUKUK DAİRESİ\n... Birinci Başkanlık Kurulu'nun 22/06/2021 tarih, 196 sayılı kararı ve ... Kanunu'nun 10.maddesi gereğince yapılan daire kapatma ve birleştirme işlemleri sonucu 01.07.2021 tarihinden itibaren  . Hukuk Dairesi numarasının   . Hukuk Dairesi olarak değiştirilmesine karar verilmiştir.\n Bu nedenle iş bu dosyanın  . Hukuk Dairesine DEVRİNE ve esasın bu şekilde kapatılmasına karar verildi."
    },
    {
        "id": "672422400",
        "daire": "15. Hukuk Dairesi",
        "esasNo": "2020/3346",
        "kararNo": "2021/3447",
        "kararTarihi": "01.07.2021",
        "arananKelime": "hukuk dairesi",
        "index": 15,
        "siraNo": 315,
        "kararMetni": "15. Hukuk Dairesi         2020/3346 E.  ,  2021/3447 K.\n\n\n\"İçtihat Metni\"\nHUKUK DAİRESİ\n... Birinci Başkanlık Kurulu'nun 22/06/2021 tarih, 196 sayılı kararı ve ... Kanunu'nun 10.maddesi gereğince yapılan daire kapatma ve birleştirme işlemleri sonucu 01.07.2021 tarihinden itibaren . Hukuk Dairesi numarasının . Hukuk Dairesi olarak değiştirilmesine karar verilmiştir.\n Bu nedenle iş bu dosyanın . Hukuk Dairesine DEVRİNE ve esasın bu şekilde kapatılmasına karar verildi."
    },
    {
        "id": "672422100",
        "daire": "15. Hukuk Dairesi",
        "esasNo": "2021/3299",
        "kararNo": "2021/5798",
        "kararTarihi": "01.07.2021",
        "arananKelime": "hukuk dairesi",
        "index": 16,
        "siraNo": 316,
        "kararMetni": "15. Hukuk Dairesi         2021/3299 E.  ,  2021/5798 K.\n\n\n\"İçtihat Metni\"\n HUKUK DAİRESİ\n... Birinci Başkanlık Kurulu'nun 22/06/2021 tarih, 196 sayılı kararı ve ... Kanunu'nun 10.maddesi gereğince yapılan daire kapatma ve birleştirme işlemleri sonucu 01.07.2021 tarihinden itibaren . Hukuk Dairesi numarasının . Hukuk Dairesi olarak değiştirilmesine karar verilmiştir.\n Bu nedenle iş bu dosyanın . Hukuk Dairesine DEVRİNE ve esasın bu şekilde kapatılmasına karar verildi."
    },
    {
        "id": "672421700",
        "daire": "15. Hukuk Dairesi",
        "esasNo": "2020/3103",
        "kararNo": "2021/3413",
        "kararTarihi": "01.07.2021",
        "arananKelime": "hukuk dairesi",
        "index": 17,
        "siraNo": 317,
        "kararMetni": "15. Hukuk Dairesi         2020/3103 E.  ,  2021/3413 K.\n\n\n\"İçtihat Metni\"\n HUKUK DAİRESİ\n... Birinci Başkanlık Kurulu'nun 22/06/2021 tarih, 196 sayılı kararı ve ... Kanunu'nun 10.maddesi gereğince yapılan daire kapatma ve birleştirme işlemleri sonucu 01.07.2021 tarihinden itibaren . Hukuk Dairesi numarasının . Hukuk Dairesi olarak değiştirilmesine karar verilmiştir.\n Bu nedenle iş bu dosyanın . Hukuk Dairesine DEVRİNE ve esasın bu şekilde kapatılmasına karar verildi."
    }
]